Date,Time,Headlines,Description,tb_sentiment,vs_sentiment,ann_sentiment,cnn_sentiment
2020-07-17,19:51:00,Jim Cramer: A better way to invest in the Covid-19 vaccine gold rush,"""Mad Money"" host Jim Cramer recommended buying four companies that are supporting vaccine developers.",2,2,2,2
2020-07-17,19:33:00,Cramer's lightning round: I would own Teradyne,"""Mad Money"" host Jim Cramer rings the lightning round bell, which means he's giving his answers to callers' stock questions at rapid speed.",0,1,2,1
2020-07-17,19:25:00,"Cramer's week ahead: Big week for earnings, even bigger week for vaccines","""We'll pay more for the earnings of the non-Covid companies if The Lancet publishes some good news from AstraZeneca's vaccine trial,"" Cramer said.",1,0,2,2
2020-07-17,16:24:00,IQ Capital CEO Keith Bliss says tech and healthcare will rally,"Keith Bliss, IQ Capital CEO, joins ""Closing Bell"" to talk about the broader markets, including the performance of the S&P 500 and the Nasdaq.",0,2,1,1
2020-07-16,19:36:00,"Wall Street delivered the 'kind of pullback I've been waiting for,' Jim Cramer says","""Look for the stocks of high-quality companies that are going lower even though they deserve to go higher,"" the ""Mad Money"" host advised.",2,1,2,0
2020-07-16,19:23:00,Cramer's lightning round: I would just stay long Wex,"""Mad Money"" host Jim Cramer rings the lightning round bell, which means he's giving his answers to callers' stock questions at rapid speed.",0,1,2,1
2020-07-16,20:03:00,Acorns CEO: Parents can turn $5 into five figures for their kids through 'power of compounding',"Investing $5 per day can compound to $70,000 by the time a child reaches adulthood, said Noah Kerner, CEO of micro-investing app Acorns.",0,1,1,1
2020-07-16,08:54:00,Dividend cuts may mean rethinking your retirement income strategy,"Hundreds of companies have cut or suspended their dividends so far this year, and the second half of the year is when investors will feel those reductions the most.",0,1,2,0
2020-07-15,20:25:00,"StockX has authenticated 1 million Jordan sneakers this year, CEO says","""We've been able to capture these cultural moments,"" like ESPN's release of the ""The Last Dance"" earlier this year, CEO Scott Cutler said on ""Mad Money.""",0,1,2,1
2020-07-15,19:51:00,Biohaven Pharmaceuticals lands Khloe Kardashian as influencer of new migraine drug,Biohaven CEO Vlad Coric said the company brought on Khloe Kardashian to promote its migraine treatment to break the stigma around it.,0,0,1,1
2020-07-15,19:24:00,Cramer's lightning round: I like Beyond Meat,"""Mad Money"" host Jim Cramer rings the lightning round bell, which means he's giving his answers to callers' stock questions at rapid speed.",0,2,2,1
2020-07-15,18:51:00,"Cramer: We desperately need another round of federal stimulus, despite vaccine progress","""We figured we'd have maybe the virus contained in early fall, but we botched the reopening and now states are being forced to shut down again,"" the ""Mad Money"" host said.",0,1,1,0
2020-07-14,19:31:00,Cramer's lightning round: Buy more VMware,"""Mad Money"" host Jim Cramer rings the lightning round bell, which means he's giving his answers to callers' stock questions at rapid speed.",0,1,2,1
2020-07-14,19:23:00,"Wall Street did something 'highly unusual' in Tuesday's session, Jim Cramer says","""This market is divided into four camps,"" the ""Mad Money"" host said.",0,1,1,1
2020-07-14,19:02:00,"Charts suggest the S&P 500 climb will stall out at the end of July, Jim Cramer warns","The charts, as interpreted by Larry Williams, suggest the S&P 500 could climb another 5% in coming weeks before equities begin to retreat, Cramer said.",0,0,1,1
2020-07-13,21:05:00,Salesforce's Marc Benioff: Face masks can end the U.S. coronavirus crisis within weeks,"Salesforce CEO Marc Benioff told CNBC's Jim Cramer that face masks can stop the coronavirus crisis in the U.S. in ""just three weeks."" The two are sponsoring a mask design challenge.",0,1,1,0
2020-07-13,20:33:00,"Crown Castle's 'good story can get even better' on activist fight, Jim Cramer says","Either Crown Castle becomes a leaner, meaner cell tower play with a high dividend, or the company ups its game to fend off Elliott Management's activist position, the ""Mad Money"" host said.",2,2,2,1
2020-07-13,21:43:00,Ellevest's Sallie Krawcheck says the economic crisis has caused a 'she-cession',"Ellevest CEO Sallie Krawcheck, who co-founded the digital investment firm for women, explained how the pandemic is affecting women, and women of color even more severly.",2,1,1,0
2020-07-13,19:38:00,Cramer's lightning round: Zoom's pullback is a buying opportunity,"""Mad Money"" host Jim Cramer rings the lightning round bell, which means he's giving his answers to callers' stock questions at rapid speed.",0,2,2,1
2020-07-13,19:24:00,"Cramer's earnings watch: 'If the banks get hammered, things could get ugly'","""This is the week when we find out if the real world is going to intrude on the stock market world,"" the ""Mad Money"" host said.",0,1,2,1
2020-07-07,01:50:00,Stay invested in US markets for the next two years: Strategist,"Washington Crossing Advisors' Chad Morganlander says he sees earnings per share potential staying quite robust over the next 24 months, and to stay invested in high-quality sectors and growth names to avoid getting out of the market at the wrong time.",0,0,1,2
2020-07-06,04:59:00,DBS sees signs of a 'healthy' US market rally,"Hou Wey Fook of DBS Bank says the U.S. equity rally has been broad, which is a positive indicator. He also explains why the entry of retail investors is a good thing for the markets.",2,2,2,2
2020-07-02,22:57:00,Aggressive policy bolstering markets: Hirtle Callaghan,"Hirtle Callaghan's Jonathan Hirtle thinks this recession is one of design, and gives his range predictions for the S&P 500 and the U.S. 10-year treasury.",0,1,1,1
2020-07-02,19:27:00,"Cramer's week ahead: Big business is bouncing back, and bouncing back with a vengeance","""The stock market is not a proxy for the economy, it's a proxy for big business,"" the ""Mad Money"" host said.",0,1,1,1
2020-07-02,19:37:00,Cramer's lightning round: I don't like Archer-Daniels-Midland Co,"""Mad Money"" host Jim Cramer rings the lightning round bell, which means he's giving his answers to callers' stock questions at rapid speed.",0,1,2,1
2020-07-02,19:00:00,Sustainable produce supplier Apeel lands deal with Wakefern grocery stores,Apeel will bring limes to Wakefern Food grocery stores in July. The deal is striving to save 1.4 million limes from going bad each year.,0,1,2,2
2020-07-01,20:35:00,Jim Cramer deciphers the speculative and blue-chip stocks driving the market,"""The whole market's being upended by the pandemic and the lines they are shifting,"" the ""Mad Money"" host said.",0,1,0,1
2020-07-01,20:00:00,Cramer's lightning round: BlackRock is a buy,"""Mad Money"" host Jim Cramer rings the lightning round bell, which means he's giving his answers to callers' stock questions at rapid speed.",0,1,2,1
2020-07-01,19:13:00,"The S&P 500 'could get ugly' in the near future, Jim Cramer warns","The S&P 500 could be riding into a ""make-or-break moment"" in the short term, the ""Mad Money"" host said.",0,1,1,1
2020-06-30,20:00:00,Conagra CEO on revamping Mrs. Butterworth's brand: 'Perception is reality',"""Mrs. Butterworth's was really architected to resemble a loving grandmother, but we can understand how some people may view it differently, may find it offensive,"" Conagra CEO Sean Connolly said.",1,1,1,1
2020-06-30,19:33:00,Cramer's lightning round: Nokia has 'good things coming',"""Mad Money"" host Jim Cramer rings the lightning round bell, which means he's giving his answers to callers' stock questions at rapid speed.",0,2,2,1
2020-06-30,19:28:00,Jim Cramer breaks down his favorite stocks from a record second quarter,"The best stocks of the second quarter were the ones with ""a lot of ingenuity and a lot more good luck,"" the ""Mad Money"" host said.",1,2,2,1
2020-06-29,19:41:00,Jim Cramer: We saw a lot of 'encouraging signs' in Monday's session,"""We had a lot of encouraging signs today, but keep in mind that this market loves veering from one extreme to the other,"" Cramer said.",0,2,1,2
2020-06-29,19:14:00,Cramer's lightning round: James Taiclet will make Lockheed Martin some money,"""Mad Money"" host Jim Cramer rings the lightning round bell, which means he's giving his answers to callers' stock questions at rapid speed.",0,1,2,1
2020-06-29,19:02:00,Restaurant Brands CEO: Popeyes' chicken sandwich has had an unprecedented impact on business,"Popeyes' viral chicken sandwich brought in new customers who are ""now experimenting and exploring the entire menu,"" Restaurant Brands CEO Jose Cil said.",0,1,2,1
2020-06-29,19:01:00,"Cramer adds new stocks, recommends buying 12 laggards in his Covid-19 index","""When you look at the biggest winners in the index, they're overwhelmingly tech companies that help facilitate the stay-at-home economy, and a lot of these got hit today,"" the ""Mad Money"" host said.",0,2,1,0
2020-06-25,19:36:00,Marc Benioff says 35 states are now using Salesforce's contact tracing technology for coronavirus,"""This is a time where every company needs to reassess its relevance to maintain its market share and innovation,"" Salesforce CEO Marc Benioff said in a ""Mad Money"" interview.",0,0,1,1
2020-06-25,19:31:00,Cramer's lightning round: Stay in Yeti,"""Mad Money"" host Jim Cramer rings the lightning round bell, which means he's giving his answers to callers' stock questions at rapid speed.",0,1,2,1
2020-06-25,19:02:00,"The stay-at-home stocks surged as Texas paused reopening, Jim Cramer says","After Texas put a pause on its reopening, ""many of today's winners were the usual suspects that benefit from the pandemic,"" the ""Mad Money"" host said.",0,0,2,2
2020-06-24,21:02:00,"The Awaken America trade has taken a turn for the worse, Jim Cramer warns","""I want you to raise a little cash so you can put it to work buying stocks at lower levels,"" the ""Mad Money"" host advised after a brutal sell-off on Wall Street.",0,1,1,0
2020-06-24,19:36:00,Cramer's lightning round: Buy Ulta Beauty,"""Mad Money"" host Jim Cramer rings the lightning round bell, which means he's giving his answers to callers' stock questions at rapid speed.",0,2,2,1
2020-06-24,18:59:00,Rhode Island governor mulls restrictions on travelers from coronavirus hotspot states,Rhode Island Gov. Gina Raimondo said she is considering new mitigation actions after neighboring states announced a quarantine for some inbound travelers.,1,1,2,0
2020-06-26,10:30:00,"Albertsons stock is worth buying at $25 after it IPOs, Jim Cramer says","""It's definitely not best of breed, but it's not garbage either,"" the ""Mad Money"" host said.",0,1,2,1
2020-06-24,05:12:00,"The U.S. recovery might not be V-shaped, but 'more like a square-root sign': Blackstone","Byron Wien, vice chairman at Private Wealth Solutions Group at Blackstone, weighs in on the shape of the economic recovery.",2,2,1,1
2020-06-23,22:09:00,We expect a U-shaped economic recovery: Strategist,"Erik Knutzen of Neuberger Berman says he's cautious about the trajectory of the market and economic recoveries, and explains why his base case scenario is for U.S. GDP to contract 6% this year.",0,1,2,2
2020-06-23,20:08:00,Jim Cramer says playing Larry Williams' Fourth of July trade 'makes a lot of sense',"""If you want a short-term trade with a terrific track record, [Larry] Williams says you should buy the S&P two days before July 4,"" the ""Mad Money"" host said.",0,2,2,2
2020-06-23,19:13:00,Cramer's lightning round: Two thumbs up for AstraZeneca,"""Mad Money"" host Jim Cramer rings the lightning round bell, which means he's giving his answers to callers' stock questions at rapid speed.",0,1,2,1
2020-06-23,22:40:00,Impossible Foods CEO says the meat industry will be obsolete in 15 years — 'That's our mission',"""That transformation is inevitable,"" Impossible Foods founder and CEO Patrick Brown said after Starbucks launched the Impossible Breakfast Sandwich.",0,0,2,1
2020-06-22,20:29:00,"Spotify's story is starting to mirror Netflix's, Jim Cramer says","Wall Street has finally bought into Spotify's podcasting strategy and ""what matters here is subscriber growth,"" the ""Mad Money"" host said.",0,1,1,1
2020-06-22,20:24:00,"Recession and recovery stocks are working, but the trend is not sustainable, Jim Cramer says","""This was a day when both the recession stocks and the recovery stocks worked"" and ""someone, one of these two groups, has to be wrong,"" sooner or later, the ""Mad Money"" host said.",0,1,1,1
2020-06-22,19:06:00,Barstool's Dave Portnoy says he'll focus on sports betting when sports return,"""I'm enjoying the stock stuff ... It's been fun ... but I'm a sports guy. I'm a sports better,"" Barstool Sports founder Dave Portnoy said after jumping into day trading.",1,0,2,1
2020-06-22,19:02:00,Cramer's lightning round: Caterpillar needs an acceleration of our economy,"""Mad Money"" host Jim Cramer rings the lightning round bell, which means he's giving his answers to callers' stock questions at rapid speed.",0,1,2,1
2020-06-21,13:49:00,Nielsen CEO explains why he took on the additional role of chief diversity officer,"""I'm fortunate to have a very diverse team helping me and they encouraged me last year to take the title on,"" Nielsen CEO David Kenny said on CNBC on Friday.",1,0,1,1
2020-06-18,19:47:00,"Charts suggest new highs 'could be on the table' for the S&P 500, Jim Cramer says","""If the S&P 500 really does surge to 3,400, up 9.1% from these levels, maybe take something off the table,"" the ""Mad Money"" host said.",0,1,1,1
2020-06-18,19:24:00,Cramer's lightning round: A patient person can wait for GE to payoff,"""Mad Money"" host Jim Cramer rings the lightning round bell, which means he's giving his answers to callers' stock questions at rapid speed.",0,1,2,1
2020-06-18,19:02:00,Jim Cramer: 10 bull markets on Wall Street and the stocks leading the way,"The 10 bull markets ""will keep working as America reopens,"" the ""Mad Money"" host said.",0,1,2,2
2020-06-17,19:17:00,Cramer's lightning round: STMicroelectronics is a 'very good company',"""Mad Money"" host Jim Cramer rings the lightning round bell, which means he's giving his answers to callers' stock questions at rapid speed.",2,2,2,1
2020-06-17,19:12:00,Union Pacific CEO sees 'signs of optimism' in multiple markets as economy recovers,"""We are seeing the e-commerce demand flow through to our rail business,"" Union Pacific CEO Lance Fritz told CNBC's Jim Cramer.",0,2,2,2
2020-06-17,18:54:00,"Royal Pharma came public in a 'golden age of medical research,' Jim Cramer says","""I think the story is so compelling that it's worth putting on a small position even up here,"" the ""Mad Money"" host said.",0,1,1,2
2020-06-17,18:44:00,Cramer advises investors to continue investing based on the 'new normal',"""These social distancing stocks have become some of the best investments around. I think they'll stay that way until we get a vaccine,"" the ""Mad Money"" host said.",2,0,1,1
2020-06-16,20:11:00,"Cramer channels Wall Street legend Martin Zweig: 'Don't fight the tape, don't fight the Fed'","""Mad Money"" host Jim Cramer broke down what drove Tuesday's market rally.",0,1,1,0
2020-06-16,19:00:00,Cramer reacts to Trump administration's potential $1 trillion infrastructure proposal,CNBC's Jim Cramer weighs his favorite stock picks amid talks of the Trump administration considering a massive infrastructure spending package.,1,0,1,2
2020-06-16,18:57:00,Cramer's lightning round: Let's buy some Pinterest,"""Mad Money"" host Jim Cramer rings the lightning round bell, which means he's giving his answers to callers' stock questions at rapid speed.",0,1,2,1
2020-06-16,18:57:00,Canopy Growth CEO expects weed will be legalized federally by 2022,"""My assumption is that 2022, for me, is the magic number,"" he said in a ""Mad Money"" interview.",0,2,2,1
2020-06-15,19:37:00,"Campbell Soup CEO says June pantry sales are unusually high, despite reopening economy","""I think the behaviors that were built in the last several months have the real potential to continue to provide a catalyst for improved results,"" CEO Mark Clouse said in a ""Mad Money"" interview.",0,1,2,2
2020-06-15,19:32:00,Cramer's lightning round: Virgin Galactic is 'too dangerous a game for me',"""Mad Money"" host Jim Cramer rings the lightning round bell, which means he's giving his answers to callers' stock questions at rapid speed.",0,1,2,1
2020-06-15,19:23:00,Jim Cramer: Investors concerned about spiking coronavirus cases should buy these stocks,"""As Zoom goes, so go Zscaler and CrowdStrike and Cramer-fave RingCentral,"" the ""Mad Money"" host said.",0,1,0,1
2020-06-12,20:21:00,Cramer recommends buying these 17 cloud stocks based on the 'Rule of 40',"""If the combination's over 40, you've got a good one. If it's under 40, you've got a riskier one,"" the ""Mad Money"" host said.",0,1,2,1
2020-06-12,20:03:00,Cramer's week ahead: This is the 'most overbought market in history',"""As long as you think we aren't going into a second lockdown, even as Covid cases spike, then you want to buy your favorite stocks into weakness here,"" Cramer said.",2,0,2,0
2020-06-12,20:26:00,Centene CEO calls for better education for at-risk youth as one solution to racial disparities,"""One of the things we have to do to correct this is improve the educational system in the inner city,"" health insurer Centene CEO Michael Neidorff said.",2,2,2,2
2020-06-12,19:15:00,Cramer's lightning round: Alibaba is the only Chinese stock I recommend,"""Mad Money"" host Jim Cramer rings the lightning round bell, which means he's giving his answers to callers' stock questions at rapid speed.",0,2,2,1
2020-06-11,22:22:00,Pullback on Nasdaq a good opportunity to join the uptrend: Daryl Guppy,Daryl Guppy of Guppytraders.com gives technical analysis on key U.S. market indices and VIX.,2,2,1,2
2020-06-11,20:56:00,'The threats are becoming higher' — L3Harris CEO says tech is driving the future of warfare,"""The competition of the future, the war fight of the future, is going to be based on new technology,"" L3Harris CEO Bill Brown said on ""Mad Money.""",2,1,2,1
2020-06-11,20:18:00,"CEO of Tommy Hilfiger owner vows to 'do better' on corporate diversity, social justice","PVH, the parent company of such brands as Tommy Hilfiger and Calvin Klein, plans to develop ""meaningful targets"" and be accountable, CEO Manny Chirico said.",1,2,1,1
2020-06-11,19:05:00,Cramer's lightning round: I don't want anything to do with a real estate development company,"""Mad Money"" host Jim Cramer rings the lightning round bell, which means he's giving his answers to callers' stock questions at rapid speed.",0,1,2,1
2020-06-12,04:41:00,Cramer recommends buying these stocks after Thursday's brutal rout,"""In a tough market, you need to circle the wagons around the few good names you feel comfortable buying and then buying more if they go lower,"" Cramer said.",1,0,2,2
2020-06-10,18:59:00,Cramer's lightning round: Cloudflare is good,"""Mad Money"" host Jim Cramer rings the lightning round bell, which means he's giving his answers to callers' stock questions at rapid speed.",0,2,2,1
2020-06-10,18:59:00,"Wall Street can't rally much higher without a coronavirus vaccine, Jim Cramer warns","""No broad-based rally from this level is sustainable without a major scientific breakthrough in the fight against Covid-19,"" the ""Mad Money"" host said.",0,1,1,0
2020-06-10,18:40:00,"Polaris has a 'once-in-a-generation opportunity,' Jim Cramer says","""This is a company that benefits enormously from the V-shaped recovery thesis, and it also works with a slower recovery,"" Cramer said.",0,2,2,2
2020-06-09,19:41:00,"Hertz's stock may look cheap, but Cramer cautions against buying it","""It doesn't matter how little you pay for a stock, when it goes to zero, you lose everything,"" the ""Mad Money"" host said.",2,1,1,1
2020-06-09,19:08:00,Cramer's lightning round: General Mills and Axon Enterprise are worth a buy,"""Mad Money"" host Jim Cramer rings the lightning round bell, which means he's giving his answers to callers' stock questions at rapid speed.",0,1,2,1
2020-06-09,18:37:00,Cramer urges investors to be wary of airline and cruise stocks — buy these 5 winners instead,"Cramer said Facebook, AMD, Apple, Amazon and Nvidia can go higher based on their strengths. ""That's why I keep going back to them, and you should too.""",0,2,2,1
2020-06-09,02:43:00,Markets could go even higher in this liquidity-driven rally: Professor,"As the S&P 500 wipes its 2020 losses and Nasdaq closes at a record high, Jeremy Siegel of the University of Pennsylvania explains why he thinks the markets could go higher still.",2,1,2,2
2020-06-08,22:36:00,Expect the Fed to continue to provide support to propel economy: Strategist,"Sam Stovall of CFRA discusses the U.S. economy amid the current crisis and a looming recession. Sam foresees that Fed will not be too quick to remove the stimulus, ahead of the FOMC meeting this week.",1,1,2,1
2020-06-08,19:41:00,Cramer's lightning round: Software maker Ping Identity is a buy,"""Mad Money"" host Jim Cramer says the stocks of Ping Identity and Biohaven Pharmaceuticals are worth a buy.",0,1,2,1
2020-06-08,19:39:00,Cramer: These are the stocks that helped power the Nasdaq to a record high during the pandemic,"The Nasdaq's rally is ""more representative of this market than the endless rebound in the hospitality and travel stocks"" due to reopening, Cramer said.",2,1,2,2
2020-06-08,18:50:00,CEO of Airstream maker says new people are seeing benefits of traveling by RV during pandemic,"""You really only have to stop to get gas,"" Thor Industries CEO Bob Martin said in explaining the benefits of RV travel.",0,2,2,1
2020-06-05,11:54:00,Most global indexes have surpassed our 12-month targets: CIO,"The magnitude of the rally in U.S. stocks since March has come as a surprise, says Tuan Huynh of Deutsche Bank Wealth Management. With the markets pricing in a ""blue sky"" scenario, he says now is the time to take some profits off the table.",2,0,1,2
2020-06-04,20:53:00,"The future of commerce needs more diverse voices, Shopify COO says","""We stand with our black merchants, our black employees and the black community worldwide,"" Shopify COO Harley Finkelstein said amid civil unrest in America.",2,1,1,2
2020-06-04,19:21:00,Cramer's lightning round: Macy's stock can go higher,"""Mad Money"" host Jim Cramer rings the lightning round bell, which means he's giving his answers to callers' stock questions at rapid speed.",0,1,2,1
2020-06-04,19:20:00,Jim Cramer: The pandemic led to 'one of the greatest wealth transfers in history',"""I think we're looking at a V-shaped recovery in the stock market, and that has almost nothing to do with a V-shaped recovery in the economy,"" the ""Mad Money"" host said.",2,2,1,1
2020-06-04,18:55:00,Nancy Pelosi calls for 'very strong' change in response to nationwide unrest,"""Let's take this moment to be an inflection point ... that we are going to not just proceed incrementally, but in a very strong way to do things differently,"" the House Speaker said.",2,2,1,1
2020-06-04,03:19:00,We stand behind our 3400 target for S&P 500 by Q1 2021: BMO Capital Markets,"Brian Belski of BMO Capital Markets says in addition to Fed support on liquidity, the fundamentals of economy and quality of U.S. stocks supported the 40% rally from the March lows. He sees further upside in market based on projected recovery in second half of the year.",0,0,1,1
2020-06-03,20:59:00,Crowdstrike CEO explains how the future of remote work and security will look,"The remote work wave is a ""subset of digital transformation"" and was sped up over night by the coronavirus pandemic, CEO George Kurtz said in a ""Mad Money"" interview.",0,1,1,2
2020-06-03,20:21:00,Cramer's lightning round: Microsoft fits the pattern of what this market wants,"""Mad Money"" host Jim Cramer rings the lightning round bell, which means he's giving his answers to callers' stock questions at rapid speed.",0,1,2,1
2020-06-03,18:42:00,Jim Cramer: Investors are rotating into and out of these stocks,"""Normalcy is shop until you drop. And today's action says that's exactly where we're headed,"" the ""Mad Money"" host said.",0,1,0,1
2020-06-02,21:37:00,"China is the 'first leading indicator' of a rebound in autos, Marvell Tech CEO says","China is showing ""very positive signs of production resuming,"" Marvell Technology CEO Matt Murphy said.",2,0,2,2
2020-06-03,17:32:00,Cramer's lightning round: I'm starting to warm up again to Wells Fargo,"""Mad Money"" host Jim Cramer rings the lightning round bell, which means he's giving his answers to callers' stock questions at rapid speed.",0,2,2,2
2020-06-02,18:48:00,"China and Europe 'bailed our stock market out,' Jim Cramer says","""If the rest of the world's in better shape, well, that is fantastic news for our companies that do lots of business overseas,"" the ""Mad Money"" host said.",0,0,1,2
2020-06-02,18:38:00,"Camping and RV stocks are 'back in a big way,' Jim Cramer says","""I think the pandemic has given the industry a huge long-term boost,"" the ""Mad Money"" host said.",0,0,2,2
2020-06-01,21:07:00,Chipotle CEO on stores damaged in protests: 'We can patch up and fix',"""Fortunately, all of our employees have been safe,"" Chipotle CEO Brian Niccol said in a ""Mad Money"" interview.",0,1,1,0
2020-06-02,16:56:00,Jim Cramer on Wall Street's relation to George Floyd protests: 'The market has no conscience',"The ""Mad Money"" host worries how the nationwide protests, which he generally supports, could impact the fight against coronavirus.",0,1,1,1
