Date,Time,Headlines,Description,tb_sentiment,vs_sentiment,ann_sentiment,cnn_sentiment
2019-05-21,19:06:00,Cramer's lightning round: McDonald's is 'one of the greatest stocks of our time',"Jim Cramer takes calls and gives his thoughts on McDonald's, Nektar Technologies, L Brands, and more.",2,2,1,1
2019-05-21,18:58:00,Cramer: Stay away from this 'forbidden city of stocks',Jim Cramer says there's a shortage of buyable stocks on the market and that money managers are staying out of these sectors.,0,1,0,0
2019-05-23,12:55:00,Novartis CEO calls for fixing 'distortions' in health-care system ahead of slate of drug launches,"""I can't remember a time at Novartis where year after year after year we have these significant medicines getting launched,"" CEO Vasant Narasimhan says.",1,0,2,2
2019-05-21,19:01:00,Jim Cramer: Any US-China trade deal will send the market into an 'epic rebound',"As of Tuesday, an imminent deal seems unlikely, with both countries refusing to compromise, Cramer said.",0,1,1,1
2019-05-20,21:32:00,Cramer Remix: Be very careful with Luckin Coffee's IPO,"Jim Cramer examines Luckin Coffee, the latest Chinese company to hit the tape.",1,2,1,1
2019-05-21,07:21:00,Cramer's lightning round: I feel bad if you own Intrexon — It's a loser,Jim Cramer takes calls and delivers thoughts about viewers' stock picks of the day.,0,1,1,0
2019-05-21,07:46:00,Cramer: Health care stocks are rising on hopes Biden will snag the 2020 Democratic nomination,"""Unlike Bernie Sanders or Elizabeth Warren or Kamala Harris, Biden's against 'Medicare for All,'"" the ""Mad Money"" host says.",0,2,2,2
2019-05-20,18:58:00,Jim Cramer reveals his top social media stocks,"Jim Cramer ranks the stocks of Twitter, Snap, Pinterest and Facebook.",2,2,2,2
2019-05-20,19:01:00,Jim Cramer: 'Your portfolio should have as little exposure to China as possible',"""As long as President [Donald] Trump believes that the Chinese are the ones who pay the price, he's going to keep taking a hard-line approach to these negotiations,"" Cramer said.",0,1,1,2
2019-05-18,01:07:00,Cramer Remix: InterActiveCorp is inexpensive here and is a buy right here,Jim Cramer says he doesn't understand why IAC is trading at current levels after reporting an amazing quarter.,2,0,1,1
2019-05-17,19:08:00,"Cramer's lightning round: Arena Pharmaceuticals, Yext, IAC, and more",Jim Cramer takes calls and delivers answers to caller stock picks in the latest lightning round.,2,1,1,1
2019-05-17,18:39:00,Pinterest CEO after earnings report tumble: We're in the growth phase of our business,"""We're trying to be transparent and ... we want to focus on the long term,"" CEO Ben Silbermann says.",0,2,2,1
2019-05-17,20:43:00,Cramer's week ahead: A slate of retail earnings reports could shed light on the China trade impact,"""This is the week when most retailers report, so we will be listening closely to what they say about the trade war,"" Jim Cramer says.",2,1,1,0
2019-05-19,15:25:00,"Nvidia CEO doesn't expect China to block $7 billion takeover of Mellanox, despite trade tensions",Nvidia CEO Jensen Huang tells Jim Cramer why the chipmaker won't be impacted by tariffs on Chinese imports.,0,1,1,0
2019-05-17,08:32:00,Two charts suggest the stock market may repeat the 'sins' of 2018,"Markets have seen a reprieve from selling in recent days, but NorthmanTrader founder Sven Henrich says the underlying technicals tell a different story.",0,1,2,2
2019-05-16,20:08:00,Cramer Remix: Investors should take cannabis hype with a grain of salt,"Jim Cramer explains that, while he's a believer in the cannabis business, conviction should be tempered with discipline.",0,1,1,1
2019-05-16,19:24:00,Cramer's lighting round: I like Carvana — 'I'm a millennial wannabe',Jim Cramer hears from callers and gives his thoughts on their stock picks of the day.,0,2,2,1
2019-05-16,19:41:00,Seven comeback stocks that investors could pounce on: Cramer,Jim Cramer identifies seven stocks that have lagged the broader market and are starting to catch steam.,0,1,1,1
2019-05-16,18:55:00,SoFi CEO reveals what he learned about millennial stock investing habits,"Early investors are showing ""that they don't want to put a lot of money at risk,"" SoFi CEO Anthony Soto says.",0,1,1,1
2019-05-17,00:42:00,Cramer: Trump no longer cares if his China policies hurt American businesses,"The executive action against Chinese telecommunications giant Huawei ""was a major escalation from the White House,"" Jim Cramer says.",0,1,1,1
2019-05-15,20:19:00,Cramer Remix: Here are the go-to names in an economic slowdown,"Jim Cramer says the ""Cloud Kings"" are a great secular trend to invest in during times of economic uncertainty.",1,0,2,2
2019-05-15,19:02:00,"People should be able to get health care without going bankrupt, GoodRx co-CEO says","Most Americans could go bankrupt if their health insurance won't cover high pharmaceutical prices, co-CEO Doug Hirsch says.",2,2,2,2
2019-05-16,16:00:00,"Roku CEO: Media companies are partnering with us, not destroying us","""We can really help those companies build scale if they want to use some of the marketing techniques we have on our platform,"" CEO Anthony Wood says.",1,2,1,1
2019-05-16,11:15:00,Cramer: Wednesday's 'crazy session' is a perfect example of the market's new normal,"""Turns out we can get good news, too, and some days like today the stock market actually makes sense,"" Jim Cramer says.",1,2,1,2
2019-05-14,19:24:00,"Cramer Remix: Tariffs could hurt earnings, but for some CEOs, it's worth it",Jim Cramer reveals how some CEOs are willing to take the tariff pain because they're fed up with China's trade practices.,2,1,1,1
2019-05-14,18:56:00,Cramer's lightning round: We're late to the Qualcomm party — Not here,"It's that time again! ""Mad Money"" host Jim Cramer rings the lightning round bell, which means he's giving his answers to callers' stock questions at rapid speed.",0,2,2,1
2019-05-14,18:52:00,Adobe CEO: We're 'optimistic' about our prospects in the wake of tariffs,"""Our exposure to China in both [creative and enterprise] is fairly minimal,"" CEO Shantanu Narayen says.",1,2,1,1
2019-05-14,18:50:00,"Tuesday saw a 'genuine rally, and that is a bullish sign,' Jim Cramer says","The stock market saw a broader rally than expected, and that's good news, the ""Mad Money"" host says.",2,1,2,2
2019-05-14,12:05:00,Cramer Remix: What's behind today's huge sell-off,Jim Cramer reveals that the coupling of an escalating trade war with China and Uber's IPO fiasco led to the market's dip.,0,1,1,0
2019-05-14,11:30:00,"Cramer's lightning round: Fox is a 'good stock,' but I prefer Disney","It's that time again! ""Mad Money"" host Jim Cramer rings the lightning round bell, which means he's giving his answers to callers' stock questions at rapid speed.",0,1,2,1
2019-05-13,19:31:00,Twitter CFO: Trade tensions won't ding our digital advertising business in China,"""That's been a great business for us,"" Twitter CFO Ned Segal says.",1,0,2,2
2019-05-14,07:47:00,Williams-Sonoma CEO: We saw China tariff hikes coming and hired more US workers,"""I think that you're better off preparing for the worst,"" Laura Alber said in a one-on-one interview with ""Mad Money's"" Jim Cramer Monday.",2,1,0,1
2019-05-13,19:36:00,Get ready to pull the trigger on these stocks — 'We're almost in oversold territory': Cramer,"The best picks may be in the managed care, insurance and telecommunication spaces.",1,2,2,1
2019-05-10,19:46:00,Cramer Remix: The Chinese government has a weak hand when it comes to trade,Jim Cramer explains why the Chinese have more to lose than we do when it comes to the trade debate.,1,1,1,0
2019-05-10,18:34:00,Cramer: These stocks were 'far more ready' for Trump's tariff hikes than investors realized,"""They've made a lot of the necessary adjustments,"" Jim Cramer says.",2,2,2,1
2019-05-10,19:32:00,Cramer adds 3 stock picks to his long-term 5G play,"Investors should fall back on their favorite long-term themes in a confusing market. The 5G buildout is one of the best, Jim Cramer says.",1,2,2,0
2019-05-10,19:27:00,"Cramer's week ahead: The market can go higher with Uber's IPO, tariffs behind us","""We made it through hell week ... We can finally start talking about earnings and interest rates again,"" Jim Cramer says.",0,1,2,2
2019-05-10,11:05:00,Should you really do nothing amid market volatility? It depends on whether you're 27 or 63,"As the longest bull market in history wanes, it can be helpful to turn your attention to your own timeline.",1,0,1,1
2019-05-10,16:45:00,Cramer Remix: Charts suggest the market could soon get a deep correction,Jim Cramer takes a look at the warning signals one analyst points out in the charts to find out what could lie ahead in this market.,0,1,1,0
2019-05-09,20:45:00,Cramer's lightning round: Zebra Technologies is a kind of fast grower we like,"It's that time again! ""Mad Money"" host Jim Cramer rings the lightning round bell, which means he's giving his answers to callers' stock questions at rapid speed.",0,2,2,1
2019-05-10,14:59:00,Etsy CEO shrugs off 'rocky' start to Q1: 'We feel really good',Etsy CEO Josh Silverman tells Jim Cramer he is optimistic about the rest of the year and explains the e-commerce platform's plan to reduce carbon emissions.,2,2,2,2
2019-05-09,18:57:00,"Cramer: How Trump's 'surreal, fanciful vision' can force China to a trade agreement","Trump can attempt to mitigate the damage by floating some good news about trade discussions as he did Thursday, Cramer says.",1,2,1,2
2019-05-09,18:56:00,'Hell week' is almost over for the markets — Cramer reviews the winners,"""When a sell-off goes into its third day, the buyers just stand there and absorb the market's body blows. And then stocks start rallying like nobody's business,"" Jim Cramer says.",0,0,1,1
2019-05-08,19:53:00,Cramer Remix: LendingTree could get a boost from lower interest rates,Jim Cramer explains how LendingTree has overcome the short sellers and can succeed with lower interest rates.,0,2,1,1
2019-05-13,11:25:00,Nestle CEO: We have a lot to show in the vegan burger market,Nestle CEO Mark Schneider explains the company's plans to roll out plant-based food in Europe and the United States.,0,0,1,1
2019-05-08,20:00:00,Cramer's lightning round: I have no energy for these energy companies,Jim Cramer takes calls and delivers answers to viewers' favorite stock picks of the day in rapid speed.,1,0,2,1
2019-05-08,19:28:00,Under Armour CEO says the company is ready to 'reset ourselves' in North America,"Under Armour CEO Kevin Plank breaks down how the sports apparel manufacturer is positioning itself for sustainable, long-term growth.",0,2,2,0
2019-05-08,19:26:00,"Cramer: Markets could roar after we get past Friday's Uber, tariff gauntlet","Even if the Uber IPO gets botched and the world's largest economies do not come to a trade truce on Friday, the market will remain in decent shape at the end of the week, Cramer said.",1,1,1,1
2019-05-08,12:28:00,These 6 stocks could make or break the S&P 500's run,"The index's next move could depend on Microsoft, Amazon, Apple, Alphabet, Facebook and Berkshire Hathaway, chart master Carter Worth says.",1,0,1,1
2019-05-08,11:04:00,"Cramer Remix: There aren't enough safety zones in this market, so don't buy into the weakness",Jim Cramer warns that there may be more panic – and selling – ahead as fears over U.S.-China trade relations are reignited.,1,1,1,0
2019-05-07,20:17:00,Cramer's lightning round: Don't shift positions on Starbucks. They're in fine shape,Jim Cramer zips through his responses to callers' stock picks of the day.,0,2,1,1
2019-05-07,21:13:00,Cramer: Uber's fundamentals aren't great — I wouldn't buy Friday's open,"""When you look at the fundamentals, which no one is doing … there's just not much here worth getting excited about,"" Jim Cramer says.",2,1,2,1
2019-05-07,20:04:00,Cramer: Uber's IPO and tariffs could be the 'one-two punch' that tanks the markets Friday,"""Even after today's huge losses, I am still concerned about what could happen on Friday,"" Jim Cramer says.",1,1,1,0
2019-05-06,20:28:00,Cramer Remix: China needs us more than we need China,"Jim Cramer explains how the United States has the upper hand in trade negotiations with our stronger, cash fueled economy.",2,0,0,2
2019-05-06,18:51:00,Cramer's lightning round: FedEx got hurt by China — Buy some in 3 days,Jim Cramer takes calls and delivers his assessment of viewers stock picks in rapid speed.,0,1,2,0
2019-05-06,19:36:00,Jim Cramer swaps Twilio for Red Hat in his 'cloud kings' group of hot tech stocks,"""I'm not going to tell you that it's cheap, but I'd much rather own Twilio than these shiny new objects,"" Cramer said.",1,1,1,1
2019-05-06,19:35:00,Ford's rebound is just getting started — here's why it's the only auto Cramer endorses,"""Ford no longer wants to make cars everywhere, no matter what the cost. It doesn't want a one-car-fits-all worldwide strategy,"" Jim Cram says.",1,2,1,1
2019-05-06,19:34:00,Cramer: Trump's tariff threat sent investors running to domestic stocks Monday — that's a good sign,"""Normally when the market gets hammered, people wait around for a few days before putting their money back to work. Not today,"" Jim Cramer says.",2,1,2,0
2019-05-03,20:11:00,Cramer Remix: Occidental Petroleum's deal with Buffett is ill-advised,Jim Cramer breaks down Buffett's investment in Occidental and why he thinks the company could get a better deal elsewhere.,1,0,1,0
2019-05-03,19:17:00,"Cramer's lightning round: IPG is inexpensive, but don't buy it here",Jim Cramer zips through his takes on callers' stock picks of the day.,0,1,1,1
2019-05-03,19:57:00,"Cramer: Why investors must time the big funds, not the business cycle, to win in this market","""If you wait for a particular cycle to turn, you'll be too late — by the time there's clear evidence, you've already missed the move,"" Cramer said.",2,2,1,1
2019-05-06,08:36:00,"Cramer's week ahead: A red-hot market, and Uber's IPO","""We've got a runaway freight train of a market and I'd love to see the darned thing cool off for more than a session or two,"" the host said.",1,0,1,2
2019-05-03,13:51:00,Cramer Remix: Why buybacks have not benefited Bed Bath & Beyond,Jim Cramer explains how the retailer has hurt itself by spending fortunes buying back stock.,0,1,1,0
2019-05-02,19:02:00,"Cramer's lightning round: Cirrus is an Apple supplier, but I wouldn't buy here","It's that time again! ""Mad Money"" host Jim Cramer rings the lightning round bell, which means he's giving his answers to callers' stock questions at rapid speed.",0,1,2,1
2019-05-02,19:25:00,"Cramer reviews the top activist stories of 2019: eBay, Dollar Tree, Bristol-Myers, Bed Bath & Beyond","""Sometimes, they reach an accommodation with management and it works. Other times they get involved in proxy fights ... and the trade falls apart,"" Jim Cramer says.",2,1,1,1
2019-05-02,20:02:00,Cramer: Don't expect the Fed to bow to Trump's interest rates demands,"Jim Cramer on Thursday called it a ""lunatic theory"" to think that Fed Chair Jerome Powell should have gone along with President Donald Trump's call to cut interest rates.",0,2,2,1
2019-05-02,19:28:00,Cramer breaks down why you should prepare for more market pullback,"""I am pretty sanguine about this market longer-term, but the disciplined thing to do right now is to raise a little cash, prepare for a pullback"" to do more buying, Jim Cramer says.",1,0,2,2
2019-05-01,19:46:00,"Cramer Remix: Own Apple, don't trade it — The stock could have more upside",Jim Cramer breaks down how Apple's subscription model is making the stock even more enticing.,2,1,1,1
2019-05-01,19:06:00,"Cramer's lighting round: The quarter won't be good, but buy this stock","It's that time again! ""Mad Money"" host Jim Cramer rings the lightning round bell, which means he's giving his answers to callers' stock questions at rapid speed.",0,1,2,2
2019-05-01,19:51:00,Cramer: Beyond Meat priced its IPO at $25 a share — buy in below $35 after its debut,"""At the midpoint of its current price range, Beyond Meat's going to be very expensive — it's already trading at 17-times last year's sales,"" Jim Cramer says.",0,2,2,1
2019-05-01,19:54:00,Cramer: 'We've had a terrific run' — it's time to trim some positions,"The stock market is in ""fine shape — somewhat overheated, most definitely — but I still think it makes sense to stay the course,"" Jim Cramer says.",1,2,2,2
2019-05-01,19:49:00,"AMD CEO: With new products launching, 2019 is a 'growth year'","""As we go three to five years forward, we have a lot of things in the hopper,"" CEO Lisa Su said.",0,2,2,2
2019-05-01,08:59:00,Cramer Remix: Facebook and Amazon suffered from 'guilt by association' after Alphabet's revenue woes,Jim Cramer details the irrational moves that sent the entire FANG cohort tumbling.,0,1,0,0
2019-04-30,19:47:00,Cramer's lightning round: Let this stock pullback from its all-time highs before buying,Jim Cramer gives callers his thoughts about their stock picks of the day in rapid speed.,0,1,2,1
2019-04-30,19:54:00,Homebuilder CEO saw momentum shift in Q1: 'The consumer is definitely more engaged',"TRI Pointe Homes CEO Doug Bauer says if job and wage growth remains strong, demand will continue to pick up for housing in the long run.",2,2,2,1
2019-04-30,19:52:00,Cramer: Investors who bought Apple ahead the quarter got the call right,"""Not only did Apple deliver a nice top- and bottom-line beat, but China, the major source of weakness last quarter, is turning around,"" Jim Cramer says.",2,1,1,0
2019-04-30,19:54:00,"Cramer dissects Alphabet's earnings slump: 'Sloppy execution, bad salesmanship'","""It seems like this company is constitutionally incapable of admitting that they let anybody down,"" he said.",0,1,0,0
2019-04-29,20:33:00,"Cramer Remix: What ""Medicare for All"" would mean for UnitedHealth Group",Jim Cramer breaks down what the 2020 election could mean for UnitedHealth Group.,0,1,1,0
2019-04-29,19:11:00,Cramer's lightning round: A medical device company should acquire this,Jim Cramer takes calls from viewers and lets them know his thoughts about their stock picks in rapid speed.,0,1,1,1
2019-04-29,19:20:00,3M CEO on disappointing earnings: We're getting ahead of the curve in China and weak sectors,Roman blamed challenges in China as well as in the automotive and electronics sectors for the manufacturing giant's weak first quarter earnings.,0,1,0,0
2019-04-29,19:19:00,Jim Cramer revisits his top stock picks for the 5G rollout,"In February, he declared that Skyworks Solutions, Intel, Qualcomm, Broadcom, and Xilinx were the top five semiconductor companies that stand to benefit from the building of 5G infrastructure.",2,2,1,2
2019-04-29,19:18:00,"Cramer: Be wary of stocks that rally into earnings reports, like Google-parent Alphabet did","""A gentle dip ahead of earnings can be the best vaccination against a sell-off,"" Jim Cramer says.",1,2,2,1
2019-04-26,19:57:00,Cramer Remix: This defense stock had the best conference call in the sector,Jim Cramer breaks down the recent strength behind Lockheed Martin's stock.,2,2,1,0
2019-04-26,19:47:00,Cramer's lightning round: This grocer stock has too much competition,Jim Cramer runs through his thoughts about callers' favorite stock picks of the day.,1,0,2,1
2019-04-26,19:52:00,Cramer: Ford and Honeywell can withstand Uber's onslaught on the auto sector,"""The auto industry just isn't a bedrock part of this economy anymore, and very few companies saw this coming,"" Jim Cramer says.",0,1,1,1
2019-04-26,19:59:00,Cramer's game plan: What to expect in the week of earnings and Friday's jobs report,Jim Cramer predicts that the April non-farm payroll report will be strong. He says it may trigger some to call for a more hawkish Federal Reserve.,1,0,2,2
2019-04-25,21:30:00,Cramer Remix: I think the stock market's biggest risk right now is the current IPO cycle,"Jim Cramer says the barrage of IPOs flooding the market are looking frothy, adding that it could be a sign of irrational exuberance.",0,1,2,1
2019-04-25,19:28:00,Cramer's tip to win the 2019 Stock Draft: Throw out conventional wisdom,"Cramer weighs in on which celebrity stock-pickers he's betting on to win, and offers tips for at-home investors to play along.",1,2,2,2
2019-04-25,19:23:00,Cramer breaks down the 7 reasons why Chipotle is making a comeback,Jim Cramer says Chipotle CEO Brian Niccol gave a blueprint on how to succeed in retail in the company's earnings call Wednesday.,0,0,1,1
2019-04-25,19:08:00,Cramer's lightning round: This stock can benefit from Intel's pullback,Jim Cramer zips through his responses to callers' favorite stock picks in the lightning round.,1,2,1,1
2019-04-25,09:33:00,Cramer Remix: Wall Street analysts got earnings so wrong and the stock market is playing catch up,Jim Cramer dishes on how low expectations have set the scene for positive first-quarter earnings.,0,0,1,2
2019-04-24,22:45:00,Cramer's lightning round: Why I'm staying away from most auto stocks,Jim Cramer zips through his response to caller questions about their favorite stock picks.,1,0,1,0
2019-04-25,09:28:00,CEO of cloud company Zuora: Manufacturers must adopt a subscription model in order to grow,Zuora CEO Tien Tzuo breaks down for Jim Cramer why more companies are picking up on the subscription economy to better serve their customers.,1,2,2,0
2019-04-24,20:39:00,"Domino's CEO: We need 25,000 stores by 2025 to accomplish our objectives","""It's all part of our strategy to fortress the markets that we operate in, which brings a lot of benefits,"" CEO Ritch Allison says.",0,2,2,1
2019-04-24,19:49:00,"Don't wait for the 'all clear' on chip sales to make a bet on Texas Instruments, Cramer says",Jim Cramer is warning investors not to miss out on easy gains by waiting until the end of the semiconductor cycle to buy Texas Instruments.,1,2,0,0
2019-04-24,04:25:00,The US earnings season has been 'pretty good' so far: Charles Schwab,Randy Frederick of Charles Schwab says he's surprised by how good corporate earnings in the U.S. have been. He also says the gain may have helped lift the S&P 500 to an all-time record.,2,2,2,2
2019-04-23,21:49:00,Cramer Remix: Stick with this beverage stock for the long term,"Jim Cramer explains why investors should stick with PepsiCo for the long term, especially after the company's blowout quarter.",0,1,2,1
2019-04-23,19:13:00,Cramer's lightning round: I'm sticking with this gold stock pick,Jim Cramer takes calls and gives his thoughts about different stocks in lightning speed.,0,1,1,1
2019-04-23,20:13:00,Hasbro CEO says toymaker's turnaround is on track for 2019,"The toymaker saw its franchise brands, emerging brands, and gaming business grow in the second quarter and is focused on digital gaming expansion.",0,0,2,2
2019-04-23,19:37:00,Cramer: Investors betting against Hasbro and Twitter bolstered markets to record highs,"""Days like today remind us that short-sellers can serve as rocket fuel for a bull market,"" Jim Cramer says.",0,0,2,1
2019-04-18,19:47:00,Cramer Remix: Big banks have kicked off earnings season in a surprising fashion,Jim Cramer details how the group is doing better than expected and remains cheap even after the latest leg higher.,2,2,2,1
2019-04-18,19:05:00,Cramer's lightning round: This stock needs to find out its calling,Jim Cramer takes calls from viewers and opines on their stock picks of the day.,0,1,1,1
2019-04-18,19:13:00,"Cramer: Overvalued stocks like Pinterest, Zoom could lead to a market peak","""The top of the market always comes when there is tremendous euphoria, and today we saw that euphoria in the two deals that went off hot,"" Jim Cramer says.",1,2,2,2
2019-04-18,19:08:00,Cramer's game plan: Overvalued IPOs can dim a positive earnings season,Jim Cramer breaks down the week ahead in earnings and stock trading.,0,2,2,1
2019-04-17,20:19:00,Cramer Remix: Waste Management is the stock to get into here,Jim Cramer explains why investors should consider Waste Management for their portfolios after the company's latest acquisition.,1,1,1,1
2019-04-17,19:36:00,Cramer: Chevron's Anadarko merger won't be the only oil deal this year,Jim Cramer explains why more mergers in the energy and oil space could be in the works.,1,0,1,1
2019-04-17,19:49:00,"Cramer: Netflix's content will be enough to hang with Disney, streaming competitors","""It's all about peer pressure. That's why [CEO] Reed Hastings is right when he says: 'the real metric is can we keep members happy,'"" Jim Cramer says.",1,0,2,1
2019-04-17,19:50:00,Cramer: Look to CSX earnings for your next stock play,Jim Cramer breaks down CSX Transportation's revenue data to discover industries and stocks that are worth making a buy.,0,2,1,0
2019-04-17,11:40:00,Cramer Remix: This industry is signaling there's no rationale for more rate hikes,"Jim Cramer says J. B. Hunt's recent remarks on the state of business should prompt the Federal Reserve to consider rate cuts, not hikes.",2,1,1,0
2019-04-16,20:22:00,Cramer's lightning round: This stock could be ready to break out,"It's that time again! ""Mad Money"" host Jim Cramer rings the lightning round bell, which means he's giving his answers to callers' stock questions at rapid speed.",0,2,2,1
2019-04-16,21:11:00,"Cramer: Charts show there's more upside in Alphabet, Alibaba and Snap","""As much as we hate to chase on 'Mad Money,' the charts, as interpreted by Bob Lang, suggest that all three of these internet stocks have more room to run,"" the ""Mad Money"" host said.",2,1,1,1
2019-04-16,19:42:00,"Cramer: Boeing, Nike, Apple, other stocks illustrate the resiliency of this stock market",Jim Cramer breaks down the latest action on Wall street and explains why certain stocks have risen when analysts said they would fall.,1,0,0,0
2019-04-15,21:01:00,Cramer Remix: Memo to President Trump - the Fed's on your side,Jim Cramer's sending a signal to Trump as his central bank criticism continues.,0,1,1,1
