Date,Time,Headlines,Description,tb_sentiment,vs_sentiment,ann_sentiment,cnn_sentiment
2019-12-18,19:22:00,"History is on investors' side when it comes to impeachment, Jim Cramer says","In 1999, President Bill Clinton's impeachment ""was irrelevant [to stocks]. You had to use any weakness to buy and then to buy and then to buy,"" the ""Mad Money"" host says.",0,1,2,0
2019-12-18,19:20:00,Jim Cramer: 'It's a mistake to freak out about the impeachment process',"The ""Mad Money"" host says there's no need to worry on Wall Street, even if the market has more down days ahead.",0,1,1,0
2019-12-18,11:57:00,"Everything Jim Cramer said on 'Mad Money,' including housing recovery, Eli Lilly CEO, bargain stocks","CNBC's Jim Cramer breaks down the positive signs in the latest housing data, sits down with Eli Lilly's CEO and reveals stocks worth buying.",0,0,2,0
2019-12-18,07:47:00,One chart signal suggests Microsoft's mega rally could be coming to an end,"Microsoft is on a rocketship this year, but its stock charts indicate it could come back down to Earth soon.",0,1,1,0
2019-12-17,19:15:00,Cramer's lightning round: Don't own Ford — own the stock of Tesla,"""Mad Money"" host Jim Cramer rings the lightning round bell, which means he's giving his answers to callers' stock questions at rapid speed.",2,1,2,1
2019-12-17,18:34:00,"Shopify, Nvidia and PayPal shares all have 'more room to run,' Jim Cramer says","The ""Mad Money"" host goes off the charts to explain why investors may want to buy Shopify, Nvidia or PayPal on any weakness.",2,1,1,1
2019-12-17,18:34:00,Elizabeth Warren claims Eli Lilly failed on cheaper insulin. CEO says 'nonsense',"Warren's report shows ""what's broken in the rest of the pharmaceutical system,"" Eli Lilly CEO David Ricks tells Cramer.",0,1,2,0
2019-12-17,18:31:00,"Jim Cramer: Housing data show we've 'finally, finally, finally recovered' from the Great Recession","""Good news is actually good news, not a sign that things have gotten overheated and the end is nigh,"" the ""Mad Money"" host says about new housing data.",2,2,1,1
2019-12-16,19:21:00,"Everything Jim Cramer said on 'Mad Money,' including China ag buys, Warren's 2020 odds, Bill.com IPO",CNBC's Jim Cramer says he has hope in the U.S.-China trade deal and that investors should build cash if Elizabeth Warren wins the Democratic nomination.,1,0,1,1
2019-12-16,18:48:00,Cramer's lightning round: Boeing may fall below $300 a share,"Mad Money"" host Jim Cramer rings the lightning round bell, which means he's giving his answers to callers' stock questions at rapid speed.",0,2,2,0
2019-12-16,18:54:00,Jim Cramer names the price to buy newly-public fintech Bill.com 'very aggressively',"Bill.com counts Bank of America, JPMorgan Chase and American Express among its partners.",2,1,1,1
2019-12-16,18:25:00,Cramer: Keep cash on hand as 'insurance' against a Warren victory in 2020,"""Wall Street's terrified of Warren, and anything that scares the market is bad news for stock prices,"" the ""Mad Money"" host says.",0,1,1,0
2019-12-16,18:24:00,"Jim Cramer: China often reneges on deals, but 'this one feels different'","""The United States is the only country with enough pork production to actually meet China's needs. We've got the upper hand, people,"" the ""Mad Money"" host says.",0,0,1,1
2019-12-13,18:58:00,"Everything Jim Cramer said on 'Mad Money,' including earnings reports, Costco's China problem","CNBC's Jim Cramer takes a look at the week ahead in earnings reports. The ""Mad Money"" host breaks down Costco's challenges in China.",0,1,1,0
2019-12-13,18:46:00,"Cramer's lightning round: Gannett — 'Forget it, Jake. It's newspapers'","""Mad Money"" host Jim Cramer rings the lightning round bell, which means he's giving his answers to callers' stock questions at rapid speed.",0,1,2,1
2019-12-13,18:45:00,Cramer: Costco has a China problem — and it's not tariffs,"The problem is Shanghai, a city of nearly 25 million people, has only one Costco store, CNBC's Jim Cramer said.",0,1,0,1
2019-12-13,18:31:00,Cramer's week ahead: China trade deal let's us focus on some big earnings reports,"""Now that we've got a phase one trade deal with China, we can go back to focusing on the earnings,"" the ""Mad Money"" host says. ""I think next week ... we're going to see a lot of good ones.""",0,1,1,2
2019-12-12,19:23:00,"Everything Jim Cramer said on 'Mad Money,' including trade deal stocks, Robinhood fractional shares","""Mad Money"" host Jim Cramer names stocks worth buying on a trade deal, argues against free trade with China and sits down with a Robinhood co-CEO.",0,1,1,0
2019-12-12,18:58:00,"More than 200,000 signed up for fractional stock trading on day one, Robinhood co-CEO says","""We see customers' eyes light up when they deposit $10 or $100 and the entire universe of stocks ... is available to them,"" Robinhood co-CEO Vladimir Tenev says.",2,1,2,2
2019-12-12,18:46:00,Cramer's lightning round: Let Alteryx come down further,"""Mad Money"" host Jim Cramer rings the lightning round bell, which means he's giving his answers to callers' stock questions at rapid speed.",0,1,2,0
2019-12-13,06:56:00,Jim Cramer: 'I almost hope China reneges' on its trade promises,"The ""Mad Money"" host lays out why he has a hard-line stance on trade with China.",0,2,0,1
2019-12-12,18:54:00,Jim Cramer reveals a list of stocks worth buying on a US-China trade deal,"""Just remember, please, these are mostly short-term trades, not investments,"" the ""Mad Money"" host says.",2,2,1,1
2019-12-12,10:19:00,"Art Hogan sees S&P 500 making double-digit gains in 2020, led by 3 groups","The S&P 500 could see another year of double-digit gains as investors look at some unloved groups, says National Securities' Art Hogan.",0,2,2,2
2019-12-12,09:23:00,Art Hogan sets 2020 price target,National Securities Chief Market Strategist Art Hogan talks his bullish S&P 500 forecast for the year ahead with CNBC's Mike Santoli.,0,0,2,2
2019-12-11,19:49:00,"Everything Jim Cramer said on 'Mad Money,' including bullish on Tesla, millennial homebuying","""Mad Money"" host Jim Cramer breaks down why Tesla has the green light. Later in the show he reveals signs that the millennial homebuying market is heating up.",0,1,1,0
2019-12-11,18:50:00,Cramer's lightning round: Lockheed Martin is a buy,"""Mad Money"" host Jim Cramer rings the lightning round bell, which means he's giving his answers to callers' stock questions at rapid speed.",0,1,2,1
2019-12-11,18:37:00,"Recent homebuyer numbers show 'spending is just beginning' for millennials, Cramer says","""After a decade of cocooning, millennials want to buy homes that represent value, which is in keeping with the way they shop for everything else,"" CNBC's Jim Cramer says.",0,0,1,1
2019-12-11,23:31:00,Jim Cramer turns bullish on Tesla — 'I'm a true believer',"Elon Musk ""is a great CEO when he can get out of his own way, and that seems to be what he's doing,"" the ""Mad Money"" host says.",2,2,2,2
2019-12-11,15:00:00,"Art Hogan predicts double-digit 2020 gains, sees 3 groups leading charge","National Securities Chief Market Strategist Art Hogan talks the Federal Reserve, 2020 predictions and his bullish S&P 500 forecast for the year ahead with CNBC's Mike Santoli.",0,2,2,2
2019-12-10,19:16:00,"Everything Jim Cramer said on 'Mad Money,' including 5G plays, the next bull leg, trade uncertainty","CNBC's Jim Cramer explains why investors should buy the dip in 5G stocks, ponders how natural resource sectors can carry the market higher in 2020 and reveals why trade uncertainty is creating buying opportunities.",1,0,2,1
2019-12-10,18:58:00,Cramer: Trade uncertainty gives investors chance to buy stocks at discount,"Predicting President Trump's next move in the U.S.-China trade war is a difficult task, CNBC's Jim Cramer said. But investors can use that uncertainty to their advantage, he says.",0,1,1,1
2019-12-10,18:50:00,Cramer's lightning round: GW Pharma is a long-term hold,"""Mad Money"" host Jim Cramer rings the lightning round bell, which means he's giving his answers to callers' stock questions at rapid speed.",0,1,2,2
2019-12-10,18:34:00,Charts show natural resource sectors can give the bull another leg to run on in 2020: Jim Cramer,"If the metals and mining, basic materials and energy sectors can rebound, ""then 2020 could be a very good year,"" the ""Mad Money"" host says.",0,2,1,1
2019-12-10,18:18:00,"Buy these 5G stock plays if they take a dip from US-China trade news, Jim Cramer says","""At a time like this, we need big apolitical themes that work no matter what, and the best of them should work for years,"" the ""Mad Money"" host says.",0,2,2,1
2019-12-09,19:49:00,"Everything Jim Cramer said on 'Mad Money,' including Fed and tariffs, department store woes, AT&T","CNBC's Jim Cramer breaks down how investors should play Wednesday's Fed announcement, Trump's tariff hike threat on China and invest in AT&T's stock.",0,1,0,0
2019-12-09,19:11:00,"Jim Cramer: Macy's, Kohl's 'have never felt more irrelevant'","""The problem for Macy's and Kohl's and Nordstrom is that ... their position gets worse and worse with every passing year,"" Jim Cramer says.",0,1,0,0
2019-12-09,19:05:00,Cramer's lightning round: Ring the register on Fitbit,"""Mad Money"" host Jim Cramer rings the lightning round bell, which means he's giving his answers to callers' stock questions at rapid speed.",0,1,2,1
2019-12-09,19:51:00,"AT&T shares can go 'much, much higher' from here if management can deliver, Jim Cramer says","A MoffettNathanson analyst last month issued a sell rating on AT&T's stock. ""Mad Money's"" Jim Cramer says the call misses the forest for the trees.",0,1,2,0
2019-12-09,19:00:00,"Jim Cramer: Be ready to buy stocks if this Fed, tariff scenario happens","If the Fed teases potential interest rate hikes and Trump follows through on higher tariffs, ""you have to be ready to buy [stocks],"" Jim Cramer says.",2,2,2,2
2019-12-06,19:14:00,"Everything Jim Cramer said on 'Mad Money,' including looming earnings, Dec. 15 tariffs, Boot Barn","CNBC's Jim Cramer looks at the week ahead in company earnings and stock market news, sits down with Boot Barn CEO Jim Conroy to get insight into its brick-and-mortar plans and says President Trump should authorize the Dec. 15 tariff hike.",0,1,2,0
2019-12-06,18:51:00,Cramer: Trump should go forward with Dec. 15 tariffs,"The strong November jobs report shows Trump has more flexibility in trade negotiations with China, CNBC's Jim Cramer says.",1,0,0,2
2019-12-06,18:49:00,Boot Barn CEO plans to double store count to 500: Western fashion a 'massive retail opportunity',"""We've said in the past that this is a massive retail opportunity that's been hidden in plain sight for years,"" Boot Barn CEO Jim Conroy says in a ""Mad Money"" interview.",0,2,2,2
2019-12-06,18:46:00,Cramer's lightning round: Virgin Galactic is 'a bridge too far',"""Mad Money"" host Jim Cramer rings the lightning round bell, which means he's giving his answers to callers' stock questions at rapid speed.",0,1,2,1
2019-12-06,18:46:00,Cramer's week ahead: 'Amazing' jobs report gives us a break from China trade news,"""When we get an amazing employment report, we can take a break from the on-again, off-again China news and just focus on earnings,"" ""Mad Money"" host Jim Cramer says.",2,2,1,1
2019-12-05,19:42:00,"Everything Jim Cramer said on 'Mad Money,' including Americans not investing, Chipotle CEO","CNBC's Jim Cramer breaks down data behind the public's lack of interesting in buying stocks. The ""Mad Money"" host sits down with CEOs of Chipotle, ServiceNow and Edwards Lifesciences for interviews.",0,1,1,0
2019-12-05,18:56:00,"The second food-prep line gives Chipotle a 'huge advantage' in deliveries, CEO says","Chipotle CEO Brian Niccol tells ""Mad Money"" host Jim Cramer that the second prep line prevents the process from getting ""bottlenecked.""",0,2,2,2
2019-12-05,18:47:00,Cramer's lightning round: Buy Wendy's ahead of its breakfast launch,"""Mad Money"" host Jim Cramer rings the lightning round bell, which means he's giving his answers to callers' stock questions at rapid speed.",0,1,2,1
2019-12-05,18:55:00,"Jim Cramer blames bears, media for the public's low interest in stocks","""There are vast sums of money to be made here, and far too many people are missing out because they've been frightened away,"" the ""Mad Money"" host says.",0,1,1,1
2019-12-04,19:47:00,"Everything Jim Cramer said on 'Mad Money,' including market rotation, Robinhood's 10 million users","""Mad Money's"" Jim Cramer breaks down how big funds are shuffling their portfolios and where individual investors can pick stock. He sits down with the CEO of Mattel toy company and the co-founders of stock-trading app Robinhood.",0,1,1,0
2019-12-04,18:59:00,Cramer's lightning round: Jack Dorsey's move to Africa is 'ill-advised',"""Mad Money"" host Jim Cramer rings the lightning round bell, which means he's giving his answers to callers' stock questions at rapid speed.",0,1,2,2
2019-12-04,19:31:00,"Robinhood democratizes stocks for younger generations, co-founder says","""People are paying lower prices and that's something that's gone beyond Robinhood and is now available to tens of millions of consumers across the U.S.,"" co-CEO Vladimir Tenev says.",1,1,1,0
2019-12-04,18:47:00,"The future of Mattel is about a lot more than making toys, CEO says","It includes robust footprints in areas closely related to toys such as movies, television and live events, Mattel CEO Ynon Kreiz says.",2,0,1,2
2019-12-04,18:36:00,Jim Cramer: Plan to buy these digitization plays 'on the way down',"""The companies being thrown away are those that are surfing the biggest secular growth story of our era: the digitization of enterprises,"" the ""Mad Money"" host says.",0,1,1,1
2019-12-05,19:42:00,"Everything Jim Cramer said on 'Mad Money,' including China trade fears, Salesforce co-CEO","CNBC's Jim Cramer says China is a ""much smaller issue than most people seem to realize,"" chats with Salesforce co-CEO Keith Block after the cloud company's earnings and offers stock buying advice to callers.",1,1,2,1
2019-12-03,19:03:00,Cramer's lightning round: Tobacco stocks don't deserve your money,"""Mad Money"" host Jim Cramer rings the lightning round bell, which means he's giving his answers to callers' stock questions at rapid speed.",0,1,2,1
2019-12-03,18:35:00,Salesforce co-CEO Keith Block downplays profit forecastguidance cut: 'Business looks strong',"""We had a great quarter. We have a lot of success,"" Salesforce co-CEO Keith Block tells Jim Cramer.",2,2,2,1
2019-12-03,18:11:00,Jim Cramer: China trade is a 'much smaller issue' on the market than most people realize,"Trade fears ""will eventually create fabulous discounts"" in the stock market, but ""we're not totally there yet,"" the ""Mad Money"" host says.",2,1,1,1
2019-12-03,01:59:00,The US markets are 'ridiculously complacent': Strategist,"Kathryn Vera of Bulltick Capital Markets says the U.S. markets are complacent about domestic politics, Fed policy and the trade dispute with China, and that's a cause for concern for investors",0,1,1,1
2019-12-02,19:17:00,"Everything Jim Cramer said on 'Mad Money,' including bearish feels, 'Medicare for All,' S&P forecast","""Mad Money's"" Jim Cramer says stocks need to come down more before they're safe to buy again, breaks down the latest developments in managed-care stocks and explains why Wall Street could be under pressure in coming months.",0,1,2,0
2019-12-02,18:48:00,Cramer's lightning round: I think you want to sell some Caterpillar,"""Mad Money"" host Jim Cramer gives callers his thoughts on the stocks of Biogen, Amgen, Caterpillar and others in rapid speed.",0,1,2,1
2019-12-02,18:35:00,Jim Cramer: We need more 'negativity' in the market before you can start buying again,"""Once people start worrying again, stocks will come down to more reasonable levels and then you can pounce, but we're not there yet,"" the ""Mad Money"" host says.",2,1,1,0
2019-12-02,18:34:00,"Charts show stocks will face pressure through most of Q1 2020, Jim Cramer says","Investors are turning from bullish to bearish and Larry Williams suggests investors ""try to sidestep the pain here,"" the ""Mad Money"" host says.",2,1,2,1
2019-12-02,18:58:00,Cramer: Warren's backtrack on 'Medicare for All' is a boon for this managed-care stock,"UnitedHealth's stock has ""caught fire"" due in part to Sen. Elizabeth Warren appearing to ""back away"" from her ""Medicare for All"" proposal, according to Jim Cramer.",0,1,2,0
2019-11-27,18:55:00,Cramer Remix: The biggest mistake investors can make with taxes,Jim Cramer reveals his top rule when it comes to taxes and selling stocks.,1,0,1,1
2019-11-27,18:54:00,Owning too many stocks and not enough cash can set you up for failure: Cramer,"Jim Cramer breaks down why owning fewer stocks can help make you more money, and why investors shouldn't be ashamed of having cash on hand.",1,0,0,0
2019-11-27,18:43:00,Cramer: I helped investors through the 2010 flash crash by following one key rule,"Jim Cramer builds on his ""nobody ever made a dime panicking"" mantra by explaining how investors can apply it to their portfolios.",0,1,1,1
2019-11-27,18:27:00,"Never buy a stock all at once — you'll almost definitely get burned, says Jim Cramer",Jim Cramer doubles down on his key investing rule of never buying a desired stock all in one go.,0,2,2,1
2019-11-27,18:14:00,"Cramer's top 2 investing rules for bulls, bears and everyone in between",Jim Cramer shares the two most important investing rules he has learned after nearly 40 years in the business.,2,2,1,1
2019-11-27,13:26:00,Agnico Eagle CEO: There won't be a 'substantial' number of new gold mines built,"""It's a lot tougher now than it was 10 or 15 years ago,"" Agnico Eagle Mines' Sean Boyd says.",0,0,0,2
2019-11-26,19:24:00,"Everything Jim Cramer said on 'Mad Money,' including market rally, Robinhood impact and Zappos CEO","The ""Mad Money"" host explains why the stock market has kept rallying despite some concerns. He also discusses Robinhood's impact on investing and talks tariff impact with the CEO of Zappos.",0,1,1,1
2019-11-26,18:48:00,Lightning Round Contemplate,"The ""Mad Money"" host says FedEx is too cheap right now, and he also recommended taking some shares of Arrowhead Pharmaceuticals off the table.",0,1,2,1
2019-11-26,18:50:00,Zappos CEO says trade war tariffs haven't impacted pricing yet,"Even if tariffs end up putting pressure on Zappos, Hsieh said he believes its loyal customers would continue shopping with the company due to its commitment to customer service.",0,0,1,1
2019-11-26,18:52:00,"Cramer: The stock market will continue rallying despite trade war, impeachment and other concerns","The ""Mad Money"" host explains that the stock market has remained strong because tariffs haven't been as impactful as expected, sensible mergers have been announced and employment remains robust.",0,2,0,2
2019-11-26,15:57:00,How 3D printing company Carbon is trying to shape the future of manufacturing,"""This has been an area that's been around for 25, 30 years ... We've cracked the code on how to do 3D printing 100 to 1,000 times faster,"" Carbon's Joseph DeSimone says.",0,1,2,1
2019-11-25,23:05:00,Credit Suisse sees almost 10% upside in the S&P 500 in 2020,"Jonathan Golub of Credit Suisse says the S&P 500 could move up toward 3,425 in 2020 because of a better economic backdrop and improved earnings. He also says he's not expecting a ""wonderful"" trade deal to lift markets and his optimism is not trade dependent.",1,2,1,2
2019-11-25,20:26:00,"Everything Jim Cramer said on 'Mad Money,' including mergers, buy Uber, PVH CEO and sell Sonos","CNBC's Jim Cramer explains what the recent mergers tell us about the stock market. The ""Mad Money"" host also explains why now is the right time to buy shares of Uber.",0,1,1,1
2019-11-25,19:23:00,Cramer's lightning round: Take profits and sell some shares of Sonos,"The ""Mad Money"" host also recommends buying shares of Costco when its stock pulls back. He also does not recommend Molson Coors Brewing Company.",0,2,2,1
2019-11-25,19:01:00,CEO of Calvin Klein owner warns China tariffs could soon hit US economy in a meaningful way,"The uncertainty of the U.S.-China trade war has been the biggest hindrance to business, PVH CEO Emanuel Chirico said.",2,1,1,0
2019-11-25,18:58:00,"Shares of Uber are now worth buying, Jim Cramer says","The ""Mad Money"" host has been skeptical of Uber, but he believes there is a clear path for its stock to go higher.",2,2,2,2
2019-11-25,18:11:00,Cramer: Recent mergers show stocks are not as expensive as people think,"If stocks were actually overpriced, there would not be as much merger and acquisition activity, the ""Mad Money"" host says.",0,1,1,1
2019-11-25,07:02:00,"The S&P 500's chart is signaling a near-term pullback, technical analyst warns","The last time the S&P 500's chart showed this, stocks pulled back shortly thereafter, says JC O'Hara, chief market technician at MKM Partners.",0,1,1,0
2019-11-22,19:12:00,"Everything Jim Cramer said on 'Mad Money,' including trade war progress, Clorox and SoFi CEOs",CNBC's Jim Cramer takes a look at a shortened week of Wall Street that's full of earnings reports heading into the Thanksgiving holiday. He sits down with the CEOs of Clorox and fintech disruptor SoFi.,0,0,1,0
2019-11-22,18:50:00,Cramer's lightning round: Let Tesla shares come down more before buying,"""Mad Money"" host Jim Cramer rings the lightning round bell, which means he's giving his answers to callers' stock questions at rapid speed.",0,2,2,0
2019-12-17,11:22:00,SoFi CEO predicts a 'fair amount of consolidation' to come to financial services industry,"The financial services industry really hasn't had the type of innovation that you've seen in e-commerce as you've seen in online travel,"" SoFi CEO Anthony Noto tells CNBC.",2,2,1,2
2019-11-22,18:24:00,Clorox CEO: What is good for the environment is good for business,"""We want to reduce the virgin plastic and fiber that we use in our products and packaging by 50% over the next 10 years,"" Clorox CEO Benno Dorer says.",2,2,2,2
2019-11-22,18:23:00,Cramer's week ahead: A short week on Wall Street stuffed with earnings reports,"""Will the president slaughter a turkey this year, or slaughter the market? I bet he goes for the former,"" ""Mad Money's"" Jim Cramer says.",0,1,1,0
2019-11-22,15:35:00,"'We've been in this slow melt higher,' technical analyst says","JC O'Hara, chief market technician at MKM Partners, and Steve Chiavarone, equity strategist, vice president and portfolio manager at Federated, discuss what's ahead for stocks with CNBC's Mike Santoli.",0,1,1,0
2019-11-25,11:23:00,"Everything Jim Cramer said on 'Mad Money,' including Schwab-TD Ameritrade talks, weed stocks","CNBC's Jim Cramer explains what triggered Charles Schwab and TD Ameritrade brokerages to discuss a merger, tells investors it's time to sell marijuana stocks and sits down with the CEOs of United Airlines and Advanced Micro Devices.",0,0,1,1
2019-11-21,19:14:00,Cramer's lightning round: Lululemon will be one of the 'retail survivors',"""Mad Money"" host Jim Cramer rings the lightning round bell, which means he's giving his answers to callers' stock questions at rapid speed.",0,1,2,1
2019-11-21,19:20:00,Jim Cramer: Robinhood pushed Charles Schwab to deal for TD Ameritrade,"""These companies have to combine to cut tech spending ... ad spending to defend their turf"" from app trading, ""Mad Money"" host Jim Cramer says.",0,1,1,2
2019-11-21,18:44:00,"Facts show talk of recession is way overblown, United Airlines CEO says","""I've never seen a wider gap between what is being discussed and trying to be pushed and the facts and the figures that we see,"" Oscar Munoz says.",0,1,2,2
2019-11-25,11:41:00,"Sell the pot stocks — the market is 'not what it was cracked up to be,' Jim Cramer says","""Companies need to close, funding needs to dry up, mergers must occur. Until then, these stocks are now sell-in-the-strength detritus,"" the ""Mad Money"" host says.",0,1,1,1
2019-11-20,20:23:00,"Everything Jim Cramer said on 'Mad Money,' including retail earnings, Okta and Tableau Software CEOs","CNBC's Jim Cramer breaks down the strengths and weakness behind the earnings reports in Home Depot, Lowe's, Kohl's and Target. The ""Mad Money"" host sits down with the CEOs of Okta and Tableau to get insight into the impact of technology on businesses.",0,1,1,0
2019-11-20,18:52:00,Cramer's lightning round: I do believe that AT&T is a good stock,"""Mad Money"" host Jim Cramer rings the lightning round bell, which means he's giving his answers to callers' stock questions at rapid speed.",0,2,2,1
2019-11-20,18:43:00,"Retailers such as Kohl's 'in trouble' without better digital presence or bargains, Cramer says","""Wait for the next round of tariff hikes or nasty trade rhetoric ... to knock down the whole group, and then buy the retail winners,"" Jim Cramer says.",0,1,2,1
2019-11-20,18:29:00,"Digital was key difference in rivals Home Depot, Lowe's quarterly reports, Jim Cramer says","""These days, people expect everything to be frictionless. The moment they hit any kind of problem, any speed bump, they just take their business elsewhere,"" the ""Mad Money"" host says.",0,1,1,1
2019-11-19,19:53:00,"Everything Jim Cramer said on 'Mad Money,' including trade hits to tech stocks, Salesforce CEO interview","CNBC's Jim Cramer advises investors not to give up software-as-a-service plays, despite boiling trade tensions. The ""Mad Money"" host sits down for interviews with executives of Salesforce, Square and RH.",0,1,1,0
2019-11-19,18:49:00,Cramer's lightning round: I say buy American Tower,"""Mad Money"" host Jim Cramer rings the lightning round bell, which means he's giving his answers to callers' stock questions at rapid speed.",0,1,2,1
