Date,Time,Headlines,Description,tb_sentiment,vs_sentiment,ann_sentiment,cnn_sentiment
2018-09-04,18:55:00,Cramer: Put the cloud kings on your shopping list for the September slump,"Jim Cramer recommends using market-wide pullbacks to buy shares of stocks like Adobe, Red Hat, Salesforce and Workday.",0,0,2,1
2018-09-04,18:38:00,Cramer: Amazon's $1 trillion landmark is about more than just the company,Jim Cramer says Amazon's growth and investor base helped propel the e-commerce giant to a $1 trillion market cap.,2,0,1,2
2018-08-28,15:25:00,See which stocks are underappreciated during these market highs,CNBC's Dom Chu reports on the stocks within the S&P 500 that are underappreciated.,0,1,2,1
2018-08-24,19:37:00,Cramer’s game plan: The end of earnings season can still deliver upside surprises,Jim Cramer details his game plan for the week ahead as earnings season comes to a close.,0,2,1,1
2018-08-24,17:04:00,"It will take Intel years to fix its chipmaking process and AMD will benefit, analyst says","As Intel struggles to fix its chipmaking process, semiconductor company Advanced Micro Devices will continue gaining market share, Wall Street analyst Hans Mosesmann told CNBC on Friday.",1,2,2,1
2018-08-24,15:15:00,ThirdLove CEO explains how the start-up is thriving as Victoria's Secret struggles,Jim Cramer sits down with ThirdLove CEO to hear more about how the start-up uses data to make key business decisions.,0,1,1,1
2018-08-24,16:39:00,Stocks hit all-time highs — these experts break down what investors should do next,"As stocks hit all-time highs, some fear that bull market will take a sharp turn and that history might repeat itself.",0,1,2,0
2018-08-23,19:00:00,Cramer Remix: Pessimism is weighing on this stock,Jim Cramer reveals the reason behind Micron’s recent declines. ,0,1,0,0
2018-08-23,19:02:00,Cramer's lightning round: Watch this company's earnings report next week,"Jim Cramer speeds through callers' favorite stocks, including which tech stock he predicts will report good quarterly earnings numbers next week.",1,0,2,2
2018-08-23,19:02:00,"Chinese tariffs are 'no big deal' for natural gas, Tellurian founder says",Jim Cramer sits down with Tellurian's founder Charif Souki to discuss the trade conflict's potential impacts on liquefied natural gas.,0,2,1,1
2018-08-23,18:47:00,Cramer: Williams-Sonoma shows how retail can win,Jim Cramer takes a deep dive into Williams-Sonoma to show why short-sellers are wrong about the retailer.,2,2,1,1
2018-08-23,18:40:00,Cramer: The market missed the mark on these stocks during earnings season,"Jim Cramer gave a rundown of several stocks where the market missed the mark during earnings season, including Home Depot and Lowe's.",0,1,2,1
2018-08-22,19:02:00,Cramer Remix: Investors should stop worrying about Trump headlines and focus on spending,"Jim Cramer explains how consumer spending is what drives our economy, not political turmoil.",0,0,0,0
2018-08-22,19:25:00,"Ex-Theranos CEO Elizabeth Holmes believed she was helping the world, Bad Blood author says",Jim Cramer sits down with Bad Blood author John Carreyrou to discuss Theranos and its former CEO Elizabeth Holmes.,0,1,1,0
2018-08-22,19:00:00,Cramer's lightning round: Pick this stock for a biotech play,"Cramer flies through callers' favorite stocks, including which stock to pick to get into biotech.",1,2,2,1
2018-08-22,19:15:00,Cramer: Michael Cohen plea and Paul Manafort verdict could have mixed effects on the market,Jim Cramer discusses how recent political turmoil involving Michael Cohen and Paul Manafort could propel the markets in either direction.,0,1,1,1
2018-08-22,19:15:00,Cramer: Analysts have been 'dead wrong' about retail performance,Cramer discusses the reasons why Wall Street analysts have underestimated retailers.,0,1,1,1
2018-08-22,08:30:00,"The bull market is ‘fake news’ but America will still outperform every time, strategist says","Investors shouldn't get carried away by the bull market's record, some strategists warn, as soaring equities are currently unique to the U.S. amid weak returns everywhere else. ",0,1,1,0
2018-08-22,09:31:00,"Global corrections to spread to US and ruin historic bull market, investor Peter Boockvar warns","As Wall Street embraces the longest U.S. bull market in history, Bleakley Advisory Group's Peter Boockvar is focusing on what could disrupt it.",0,1,1,0
2018-08-21,19:03:00,"Cramer Remix: Forget recession, this is simply a rotation",Jim Cramer breaks down why investors’ recession worries are overblown.  ,0,1,0,0
2018-08-22,11:10:00,Cramer: Charts show pumpkin spice lattes could help Starbucks rebound,Jim Cramer and technician Tim Collins take a look at the charts to check on Starbucks and see if the coffee chain is headed for a run.  ,0,2,1,1
2018-08-22,11:10:00,Cramer's lightning round: Buy this stock as a defensive play,"Cramer flies through callers' favorite stocks, including which company could be a good defensive play.",1,2,1,1
2018-08-22,11:07:00,Cramer: Cisco's latest quarter proves shift to software is working,Jim Cramer says that Cisco's fourth quarter is finally bearing the fruit from CEO Chuck Robbins' plan for the company.,2,1,1,1
2018-08-22,11:09:00,Cramer: The longest-ever bull market overcame these 10 obstacles,Jim Cramer named the top 10 obstacles the market had to overcome in order to achieve this record rally.,1,1,1,2
2018-08-20,19:06:00,Cramer Remix: Cannabis could put this company ahead of the curve,Jim Cramer breaks down the strategy behind Constellation Brands’ investment in Canopy Growth.,0,0,2,0
2018-08-20,19:05:00,Cramer's lightning round: Buy Twitter despite imperfect quarter,"Jim Cramer shares his take on callers' favorite stocks, including why he thinks Twitter is worth buying.",1,2,1,1
2018-08-20,19:00:00,Cramer: It’s not too late to buy Walmart,Jim Cramer explains why Walmart still has room to run.,0,1,1,1
2018-08-20,18:57:00,Cramer: Nordstrom is the latest 'retail resurrection',Jim Cramer says Nordstrom is the latest retailer to rise from the dead after the company reported strong results last week.,2,1,2,2
2018-08-20,18:47:00,"Cramer: PepsiCo, Constellation Brands should get more credit for disrupting their businesses",Jim Cramer discusses how PepsiCo's acquisition of SodaStream and Constellation Brands' investment in Canopy Growth are disrupting their businesses in the right ways.,2,2,1,1
2018-08-17,18:31:00,Cramer's game plan: Get ready for a packed earnings week,Jim Cramer looks back on August days that were more lackadaisical before launching into next week's game plan.,0,2,1,1
2018-08-16,19:00:00,Cramer Remix: The secret to Walmart’s blowout quarter lies within its own walls,Jim Cramer explains how Walmart investing in its employees helped to boost its latest earnings.,1,0,1,2
2018-08-16,19:16:00,Cramer: Don’t dismiss Sen. Elizabeth Warren’s ideas as bad for companies,"While Senator Elizabeth Warren’s economic policies are known to spark divisive reactions, CNBC’s Jim Cramer thinks that investors shouldn’t be too quick to write off her ideas as bad for business.",0,1,0,0
2018-08-16,19:01:00,Cramer's lightning round: It's a good time to buy oil stocks,"Jim Cramer zips through his take on callers' favorite stocks, including why it's a good time to buy the industry everyone hates.",1,2,2,2
2018-08-16,19:15:00,Cramer swipes right on IAC stock after Tinder co-founders' lawsuit,"Jim Cramer recommends buying IAC's stock, especially after a lawsuit from the co-founders of subsidiary Tinder caused shares to dip. ",2,0,2,1
2018-08-16,19:14:00,"Cramer: Forget FANG, the market loves WANG","Jim Cramer thinks it might be time to rethink FANG. Given Thursday's market moves, Cramer thinks WANG – Walmart, Apple, Netflix and Google – might be the new group to watch.",1,2,1,1
2018-08-15,19:01:00,Cramer Remix: The bull market is still alive and kicking,Jim Cramer explains why the stock shortage gives this bull market a real edge.,1,2,2,1
2018-08-15,19:03:00,Cramer's lightning round: Gamble on Pinnacle Entertainment,"Jim Cramer shares his take on callers' favorite stocks, including what casino stock investors should take a gamble on.",1,2,2,1
2018-08-16,11:15:00,Cramer: Post Holdings' portfolio gives stock 'room to run',Jim Cramer says Post Holdings' spin-off of its private label division and smart acquisitions have shown that the company knows how to unlock value.,0,0,1,1
2018-08-15,20:16:00,"Sen. Elizabeth Warren: Trade deals help companies, not workers","Jim Cramer sits down with Sen. Elizabeth Warren to discuss her new bill, the Accountable Capitalism Act, and also hear her views on U.S. trade policies.",0,2,1,0
2018-08-15,18:41:00,Cramer: Global sell-off isn't 'as special as it seems',"Jim Cramer explains how the global sell-off is related to Turkey, China and Macy's and why it isn't as big of a deal as investors might think. ",2,1,1,1
2018-08-14,19:22:00,Brinks CEO: We’re ‘ready’ for Canadian marijuana legalization,"Brinks CEO Douglas Pertz says that the cash management company is ready to benefit from legal cannabis in Canada, starting October 17.",2,0,2,1
2018-08-15,11:34:00,Cramer Remix: Why this stock could be red hot,Jim Cramer explains how CVS could crush the competition once the Aetna deal is complete. ,0,1,1,1
2018-08-14,19:18:00,Cramer: Tesla bears should think twice before shorting the stock,Jim Cramer says that even skeptical Tesla investors should stay away from shorting the stock because it never ends well.,0,1,1,0
2018-08-15,11:30:00,Tapestry CEO: Accessories has seen 'terrific' growth in the last year,Tapestry CEO Victor Luis tells Jim Cramer how his company beat top and bottom line expectations for its fourth quarter.,1,2,2,2
2018-08-14,19:08:00,Cramer's lightning round: Avoid stocks related to housing,"Jim Cramer shares his take on callers' favorite stocks, including why he doesn't ""want anything to do with"" housing-related stocks.",1,0,2,0
2018-08-14,19:10:00,Cramer’s charts suggest it’s still worth investing in bonds,Jim Cramer and technician Carley Garner find reasons to believe U.S. Treasury bonds still have some upside.,2,2,2,1
2018-08-14,19:09:00,"Cramer: These companies’ earnings show that millennials are spending money on handbags, not houses",Jim Cramer gives his take on shifting consumer spending habits.,0,1,1,1
2018-08-14,11:53:00,Cramer Remix: Don’t worry about this stock’s post-earnings drop,Jim Cramer breaks down why Dropbox’s recent decline is not worth fretting about,0,1,0,0
2018-08-13,18:59:00,"Cramer's lightning round: Bet on Norwegian Cruise Line, not Carnival","Jim Cramer shares his take on callers' favorite stocks, including which cruise line's numbers show the best growth.",1,0,2,1
2018-08-14,11:06:00,Cramer: Booking Holdings needs to decide whether it’s a growth stock or a value stock,Jim Cramer reviews Booking Holdings' pivot from boosting growth to boosting profits.,0,2,2,2
2018-08-13,18:45:00,"Cramer: ‘Stay away’ from banks, other contaminated stocks to ride out the Turkish crisis","Jim Cramer says that the Turkish currency crisis could be a buying opportunity for smart investors, as long as they stay away from banks and other contaminated stocks.",0,1,0,2
2018-08-10,18:29:00,Cramer's game plan: Take time to study your stocks as earnings season fades,Jim Cramer recommends investors use next week's lack of earnings reports to do their homework and make informed decisions.,0,1,1,1
2018-08-23,09:10:00,Obscure market statistic could point to record highs for S&P 500 by year-end,"While the dog days of summer have failed to produce record highs for the S&P 500, one widely followed strategist has a simple message for investors: wait until winter. ",0,1,1,2
2018-08-09,19:05:00,Cramer Remix: Trade sanctions are hurting hedge funds the most,Jim Cramer breaks down why hedge funds are feeling the pain when it comes to tariffs.,2,1,1,0
2018-08-09,19:18:00,"Cramer's lightning round: Coal may be in a renaissance, but don't buy the stocks","Jim Cramer shares his take on callers' favorite stocks at lightning speed, including a coal play that might seem intriguing.",1,0,1,1
2018-08-09,19:04:00,"Cramer praises WWE's growth story, says investors can buy 'a small position' after monster run",Jim Cramer tracks professional wrestling broadcaster WWE's growth story and explains why the stock is worth buying on a pullback.,1,2,2,2
2018-08-09,19:03:00,"Top auto supplier Magna takes $60 million hit from tariffs, but CEO still sees 'huge' opportunity","Jim Cramer sits down with Magna International CEO Don Walker, who explains the effects of the Trump administration's tariffs on his manufacturing company.",2,2,1,0
2018-08-09,19:03:00,Cramer: I'd rather own the 'given-up-on' stock of Viacom than CBS,"Jim Cramer backs Viacom's turnaround and says it has ""much more opportunity for upside"" than the beloved CBS.",2,0,0,1
2018-08-08,19:06:00,Cramer Remix: Even the Death Star can’t wipe out an industry overnight,Jim Cramer details how the stocks of CVS and AutoZone escaped from Amazon’s grips. ,0,1,1,1
2018-08-08,19:06:00,Cramer's 4 reasons for why Tesla's shorts are facing an uphill battle with Elon Musk,"Jim Cramer explains why Tesla's short-sellers might be up against ""the greatest short-buster in modern memory"" in Elon Musk.",1,0,1,2
2018-08-08,18:59:00,"Cramer's lightning round: If Zuora's stock dips, buy more","Jim Cramer zooms through his take on callers' favorite stocks, including a play on the growing subscription economy.",1,0,2,1
2018-08-08,18:55:00,Cramer says newly public Sonos reminds him of Fitbit: 'I'm not going to make the same mistake twice',Jim Cramer has his doubts about Sonos' IPO after being burned by the similarly structured Fitbit.,0,1,1,1
2018-08-08,18:55:00,Cramer: Disney's Bob Iger deserves the benefit of the doubt after earnings miss,Jim Cramer puts faith in Disney CEO Bob Iger after the entertainment giant missed Wall Street's third-quarter earnings expectations.,0,0,1,1
2018-08-07,18:59:00,Cramer Remix: Tesla news sends bond prices higher,Jim Cramer breaks down how Elon Musk’s tweet on taking Tesla private impacted the bond market.,2,1,1,1
2018-08-07,18:59:00,Cramer's lightning round: 'I don't want to be in any stock' levered to solar,"Jim Cramer flies through his take on callers' favorite stocks, including an entire group of stocks that aren't exactly piquing his interest.",1,0,2,1
2018-08-07,18:57:00,"Cramer's charts say Costco and Target are ready for pullbacks, but Walmart's a buy",Jim Cramer turns to technicians Tim Collins and Larry Williams for a look at the charts of big-box retailers boosting their e-commerce wares to compete with Amazon.,2,2,2,2
2018-08-07,18:51:00,"It's 'inevitable' that esports will be part of the Olympics, Logitech CEO says","Jim Cramer sits down with Logitech International President and CEO Bracken Darrell, who says esports will be in the Olympics and could be the biggest sport in the world.",0,1,1,1
2018-08-07,18:50:00,Cramer says index fund buying and buybacks are creating a 'stock shortage',Jim Cramer attributes the market's rally to the confluence of two drivers: increased index fund investing and corporate share buybacks.,0,0,2,2
2018-08-09,11:02:00,Cramer Remix: Why buyers are forgiving Disney ahead of earnings,Jim Cramer is explaining why buyers are forgiving and forgetting Disney’s troubles ahead of its third-quarter earnings. ,0,2,1,1
2018-08-07,12:39:00,Cramer's lightning round: Don't buy US Steel because of slower economy,"Jim Cramer shoots through his take on callers' favorite stocks, including a red-hot advertising technology stock.",1,0,2,0
2018-08-06,18:58:00,Cramer reviews Expedia's breakout quarter,Cramer talks about how Expedia has once again won over the market after its standout second-quarter earnings results.,0,0,1,2
2018-08-07,13:35:00,Cramer: Outgoing PepsiCo CEO 'saw the future coming' when few did,Jim Cramer talks about his personal experience with outgoing PepsiCo CEO Indra Nooyi.,0,2,1,1
2018-08-06,18:56:00,Cramer: Facebook's reported discussions with banks should give investors pause,Jim Cramer makes the case that investors should be slow to forgive and forget Facebook's past missteps after a report that the company is looking to get more banks and financial institutions to use Messenger.,0,1,0,1
2018-08-04,14:06:00,"One of market’s biggest bulls takes a ‘few chips off the table,’ sees impending sell-off",Steve Chiavarone predicts stocks will fall 5 to 8 percent before summer ends.,0,1,0,0
2018-08-03,18:40:00,"Cramer's game plan: 'Stick to your knitting' and keep an eye on consumer data, earnings",Jim Cramer picks through the earnings confusion in the week ahead and advises investors on how to play the action.,0,1,1,1
2019-09-21,08:55:00,11 years later: Cramer's 'They know nothing!' rant — Here's the complete transcript,Jim Cramer sounded off on the Federal Reserve for not anticipating the coming financial crisis 10 years ago today.,0,1,0,0
2018-08-02,19:06:00,Cramer Remix: Apple won’t be the only company to hit $1 trillion,Jim Cramer explains what makes Apple’s trillion dollar market cap so meaningful.,1,0,1,1
2018-08-02,19:06:00,Dow Chemical CEO: 'I've never seen the industry more aligned' around tackling plastic waste,"Jim Cramer sits down with Jim Fitterling, CEO of DowDuPont subsidiary The Dow Chemical Company, to hear about its impending spin-off and the chemical business at large.",0,1,1,0
2018-08-02,19:03:00,Cramer's lightning round: Things are looking up for Southwest Airlines—buy more,"Jim Cramer shares his take on callers' favorite stocks at lightning speed, including an airline play that could soon fly higher.",1,0,1,2
2018-08-02,18:56:00,Cramer: Don't own the stocks of companies fending off competition—they can be 'treacherous',Jim Cramer tells investors to steer clear of buying shares in companies like Red Robin Gourmet that are facing fierce industry competition.,2,0,1,0
2018-08-02,18:52:00,Cramer: 10 reasons why Apple hitting $1 trillion matters for the stock market,Jim Cramer breaks down why Apple's trillion-dollar breakthrough speaks volumes about the state of the stock market.,0,1,1,0
2018-08-02,18:57:00,"Starbucks CEO confirms Alibaba partnership, plans to expand delivery to 2,000 stores in China","Starbucks CEO Kevin Johnson tells CNBC that the coffeemaker's just-announced partnership with Alibaba will, without a doubt, ""be an accelerator for our business.""",0,2,2,2
2018-08-01,19:06:00,Cramer Remix: Why Amazon’s latest quarter was a thing of beauty,Jim Cramer explains why Amazon remains on fire despite other FANG stocks faltering.,2,2,2,1
2018-08-01,19:06:00,Cramer's lightning round: Buy some Dropbox stock ahead of its earnings report,"Jim Cramer zooms through his take on callers' favorite stocks, including a fresh-faced technology play dipping ahead of earnings.",1,0,2,1
2018-08-01,19:06:00,Cramer finds new ways to play the 'stay-at-home' economy,"Jim Cramer takes a new approach to the ""stay-at-home"" economy by flagging plays like Conagra Brands, Disney and Spotify.",2,2,1,2
2018-08-01,18:58:00,Cramer makes the case for valuing Apple's stock like Procter & Gamble's,Jim Cramer doubles down on his call for Apple's stock to be valued like any other consumer products company.,0,2,1,0
2018-08-01,18:43:00,Cramer points to the market's 'endless buying opportunities' as stocks slide on trade war worries,Jim Cramer says the market's trade-war-related dips create bountiful investment opportunities in the hardest-hit sectors.,0,0,2,0
2018-07-31,19:06:00,Cramer Remix: Apple is the greatest consumer products story ever,Jim Cramer explains why the tech giant could have staying power as a consumer product story.,2,2,1,1
2018-07-31,19:07:00,Cramer's lightning round: The case for buying the best-of-breed stock of UnitedHealth,"Jim Cramer flies through his take on callers' favorite stocks, including a health care play that's leading its sector.",1,0,2,2
2018-07-31,18:31:00,Cramer's charts suggest gold could be nearing a bottom,Jim Cramer and technician Carley Garner inspect the charts related to gold to see if the precious metal could be ripe for a run.,1,0,1,1
2018-07-31,18:51:00,"Cramer: If you're worried about the economy, just look at the retail stocks",Jim Cramer makes the case for embracing the strength of the U.S. economy by tracking the gains in top retail stocks like Walmart.,1,0,0,1
2018-07-31,18:50:00,Cramer says Apple's stock could have a $300 price target if it were only valued properly,Jim Cramer argues that Apple should be seen as a consumer products company rather than a technology player after its third-quarter earnings beat.,0,2,2,2
2018-07-30,19:07:00,Cramer Remix: Panic could help investors catch a bargain,Jim Cramer breaks down how the collateral damage of Monday’s panic could create a prime buying opportunity.,0,1,2,0
2018-07-30,19:06:00,Cramer's lightning round: Buy into Allergan's roaring stock below $180,"Jim Cramer rattles off his take on callers' favorite stocks, including a pharmaceutical play on a tear.",1,0,2,1
2018-07-30,19:06:00,Cramer says NXP Semiconductors is a buy despite failed Qualcomm deal,Jim Cramer argues that NXP Semiconductors' prospects are still intact after Qualcomm dropped its bid for the chipmaker.,0,2,1,0
2018-07-30,18:57:00,"Cramer flags the 'clear winners' of earnings season: AMD, Microsoft, Amazon and Alphabet",Jim Cramer highlights the companies that wowed analysts and investors with their mid-2018 earnings results.,0,2,0,1
2018-07-30,18:57:00,Cramer: Facebook's 'collateral damage' could be a buying opportunity,Jim Cramer recommends picking through the stocks damaged by investors' panic around Facebook earnings for hidden potential.,0,1,2,0
2018-07-28,10:50:00,Kanye West beat the market by more than 40 percent,"According to CNBC's analysis, the portfolio rapper Kanye West chose for wife Kim Kardashian has outperformed the S&P 500 Index by more than 40 percent.",2,1,2,0
2018-07-25,08:31:00,"Rising rates likely to shake stocks to core, veteran investor Peter Boockvar warns","The Bleakley Advisory Group's Peter Boockvar sees ""early tremors"" in the global bond market.",0,1,2,2
2018-07-24,23:54:00,Wall Street bull says a near-term pullback is coming,"Despite the booming economy, market strategist and Wall Street bull Tony Dwyer predicts a near-term pullback of 5 to 10 percent.",0,1,2,1
2018-07-24,19:30:00,PepsiCo taking century-old MSG contract from Coca-Cola more a symbolic than economic win: Investor,"PepsiCo taking a century-old Madison Square Garden contract from Coca-Cola is more a symbolic than economic win, says investor.",2,2,1,2
2018-07-24,19:02:00,Cramer Remix: This former market darling has an equation for gains,Jim Cramer calculates how health-focused conglomerate Danaher could still get its groove back.,0,2,1,1
2018-07-24,19:02:00,Cramer's lightning round: You haven't missed your chance to buy shares of WWE,"Jim Cramer zips through his take on callers' favorite stocks, including a subscription-based entertainment play that could still be packing a punch.",1,2,1,1
2018-07-24,18:54:00,Cramer says FANG stocks could still have room to run after Alphabet's quarter,Jim Cramer says Alphabet's latest quarter proved that shares of the Google parent and other tech titans could still have room to run.,1,0,2,0
2018-07-24,18:41:00,Cramer: Charts suggest S&P 500 could make new all-time highs by the end of earnings season,Jim Cramer enlists technician Mark Sebastian to vet the action in the VIX and ensure that another major sell-off isn't in the works.,0,0,2,1
2018-07-24,18:35:00,"Cramer: 'If I had to sum up this market in a word, I’d call it extremist'",Jim Cramer cautions against investing in extreme moves in the market before knowing what's really going on.,0,1,1,2
2018-07-24,17:03:00,David Rosenberg issues bubble warning in credit market: It will tear into stocks,Gluskin Sheff’s David Rosenberg predicts the widening credit spreads will take down stocks.  ,0,0,0,0
2018-07-23,19:04:00,Cramer Remix: Alphabet has broken this troubling trend after reporting earnings,Jim Cramer explains how Alphabet has debunked the stock’s trend in sliding post-earnings.,0,1,0,2
2018-07-23,19:05:00,Cramer's lightning round: Sell half of your position in beer stocks on concerning industry trends,"Jim Cramer flies through his take on callers' favorite stocks, including the beer space and why he thinks it's risky.",1,0,2,1
2018-07-23,18:58:00,"No longer 'trapped at a non-food company,' Frank's RedHot drives growth for McCormick, CEO says","Jim Cramer sits down with McCormick Chairman, President and CEO to get the latest on the spice maker's growth-driven business.",1,2,2,0
2019-02-28,12:06:00,"Dungeons & Dragons is having its best year ever, Hasbro CEO says","Jim Cramer speaks to Hasbro Chairman and CEO Brian Goldner, who touts his toymaker's legacy games and budding esports properties.",2,2,2,1
2018-07-23,18:48:00,Cramer: Stocks could 'go much higher' if the EU caves on tariffs,Jim Cramer says that a deal between the European Union and the United States on tariffs could spark a stock market rally.,2,0,1,2
2018-07-24,11:01:00,Markets ready to hit new highs?,Thursday will mark the 6-month mark since the last S&P 500 market high. CNBC's Mike Santoli joins the 'Fast Money Halftime Report' to discuss if there are enough factors at play to take the market to a new recovery period. ,2,2,2,2
2018-07-19,19:03:00,Cramer Remix: The most worshiped group in this market,Jim Cramer explains why analysts can’t resist the digital payment space. ,2,2,1,1
2018-07-19,18:59:00,Cramer's lightning round: Take advantage of BlackRock's rare stock dip,"Jim Cramer shares his take on callers' favorite stocks, including an investment management play that's on an unusual downtrend.",1,2,1,1
